,CATEGORY,TITLE,AUTHOR,DATE,STAR,RATING
673,Education & Teaching,"Number Tracing Book for Preschoolers and Kids Ages 3-5: Trace Numbers Practice Workbook for Pre K, Kindergarten and Kids Ages 3-5 (Math Activity Book)",Modern Kid Press,2018-04-15,4.8,5463
674,Education & Teaching,The Jesus Storybook Bible: Every Story Whispers His Name,Sally Lloyd-Jones,2007-02-20,4.9,5449
675,Education & Teaching,Romeo and Juliet (Shakespeare Made Easy),William Shakespeare,1985-04-01,4.6,4940
676,Education & Teaching,The Anatomy Coloring Book,Wynn Kapit,2013-03-27,4.6,4740
677,Education & Teaching,Grit: The Power of Passion and Perseverance,Angela Duckworth,2016-05-03,4.6,4740
678,Education & Teaching,"Trace Letters Of The Alphabet and Sight Words (On The Go): Preschool Practice Handwriting Workbook: Pre K, Kindergarten and Kids Ages 3-5 Reading And Writing",Modern Kid Press,2018-03-02,4.7,4711
679,Education & Teaching,The Chronicles of Narnia Complete 7 Volume CD Box Set (Unabridged),C. S. Lewis,2004-10-26,4.8,4675
680,Education & Teaching,Official SAT Study Guide 2020 Edition,The College Board,2019-05-07,4.6,4580
681,Education & Teaching,"School Zone - Preschool Scholar Workbook - 64 Pages, Ages 3 to 5, Preschool to Kindergarten, Reading Readiness, Early Math, Science, ABCs, Writing, and More (Deluxe Edition 64-Page)",School Zone,2014-01-01,4.7,4534
682,Education & Teaching,"The Lion, the Witch and the Wardrobe (Collins Readers)",C.S. Lewis,1983-03-01,4.7,4435
683,Education & Teaching,The Gift of Fear : Survival Signals That Protect Us from Violence,Gavin De Becker,1997-06-01,4.7,4384
684,Education & Teaching,Majestic Traditional Gold-Edged Tabs,Ellie Claire,2008-02-01,4.6,4200
685,Education & Teaching,Elements of Style Value Package (includes Brief New Century Handbook),William Strunk,2007-03-26,4.7,4195
686,Education & Teaching,"Trace Letters: Alphabet Handwriting Practice workbook for kids: Preschool writing Workbook with Sight words for Pre K, Kindergarten and Kids Ages 3-5. ABC print handwriting book",Sujatha Lalgudi,2019-08-15,4.8,4144
687,Engineering & Transportation,Marijuana Horticulture: The Indoor/Outdoor Medical Grower's Bible,Jorge Cervantes,2006-02-01,4.7,3204
688,Engineering & Transportation,Midnight in Chernobyl: The Untold Story of the World's Greatest Nuclear Disaster,Adam Higginbotham,2020-02-04,4.8,3053
689,Engineering & Transportation,The Old Farmer's Almanac 2020,Old Farmer’s Almanac,2019-09-03,4.7,3029
690,Engineering & Transportation,The Yorkshire Shepherdess,Amanda Owen,2015-05-01,4.8,2875
691,Engineering & Transportation,The Driving Book: Everything New Drivers Need to Know but Don't Know to Ask,Karen Gravelle,2015-02-10,4.6,2764
692,Engineering & Transportation,The Art Of War,Sun Tzu,2017-04-07,4.4,2767
693,Engineering & Transportation,Predictably Irrational: The Hidden Forces That Shape Our Decisions,Dan Ariely,2008-02-19,4.6,2751
694,Engineering & Transportation,Long Range Shooting Handbook: The Complete Beginner's Guide to Precision Rifle Shooting,Ryan M Cleckner,2016-01-31,4.8,2748
695,Engineering & Transportation,A Long Way Gone: Memoirs of a Boy Soldier,Ishmael Beah,2007-02-13,4.6,2717
696,Engineering & Transportation,The Burning Maze (The Trials of Apollo Book 3),Rick Riordan,2019-05-02,4.8,2653
697,Engineering & Transportation,Helmet for My Pillow: From Parris Island to the Pacific,Robert Leckie,2010-02-02,4.5,2542
698,Engineering & Transportation,El arte de la guerra (The Art of War) (Spanish Edition),Sun Tzu,2012-09-11,4.4,2508
699,Engineering & Transportation,El Arte de la Guerra (Spanish Edition),Sun Tzu,2016-01-01,4.4,2508
700,Engineering & Transportation,The Book of Unusual Knowledge,Publications International Ltd.,2012-04-01,4.6,2380
701,Engineering & Transportation,The Soul of an Octopus: A Surprising Exploration into the Wonder of Consciousness,Sy Montgomery,2015-05-12,4.6,2327
702,Engineering & Transportation,"An Astronaut's Guide to Life on Earth: What Going to Space Taught Me About Ingenuity, Determination, and Being Prepared for Anything",Chris Hadfield,2015-04-14,4.7,2315
703,"Health, Fitness & Dieting",The Power of Now: A Guide to Spiritual Enlightenment,Eckhart Tolle,2004-08-19,4.7,16650
704,"Health, Fitness & Dieting","The Boy, the Mole, the Fox and the Horse",Charlie Mackesy,2019-10-22,4.8,16044
705,"Health, Fitness & Dieting",You Are a Badass: How to Stop Doubting Your Greatness and Start Living an Awesome Life,Jen Sincero,2013-04-23,4.7,15417
706,"Health, Fitness & Dieting",The Complete Ketogenic Diet for Beginners: Your Essential Guide to Living the Keto Lifestyle,Amy Ramos,2016-12-20,4.3,14136
707,"Health, Fitness & Dieting","The Art of War (Dover Military History, Weapons, Armor)",Sun Tzu,2002-11-13,4.4,14107
708,"Health, Fitness & Dieting",Atomic Habits: An Easy & Proven Way to Build Good Habits & Break Bad Ones,James Clear,2018-10-16,4.8,13932
709,"Health, Fitness & Dieting","The Body Keeps the Score: Brain, Mind, and Body in the Healing of Trauma",Bessel van der Kolk M.D.,2015-09-08,4.8,13566
710,"Health, Fitness & Dieting","Thinking, Fast and Slow",Daniel Kahneman,2013-04-02,4.6,11620
711,"Health, Fitness & Dieting",The Gifts of Imperfection: Let Go of Who You Think You're Supposed to Be and Embrace Who You Are,Brené Brown,2010-08-27,4.7,11319
712,"Health, Fitness & Dieting",The Power of Habit: Why We Do What We Do in Life and Business,Charles Duhigg,2014-01-07,4.6,11146
713,"Health, Fitness & Dieting",Outliers: The Story of Success,Malcolm Gladwell,2011-06-07,4.6,10956
714,"Health, Fitness & Dieting",Good Days Start With Gratitude: A 52 Week Guide To Cultivate An Attitude Of Gratitude: Gratitude Journal,Pretty Simple Press,2017-09-16,4.6,10977
715,"Health, Fitness & Dieting",Make Your Bed: Little Things That Can Change Your Life...And Maybe the World,Admiral William H. McRaven,2017-04-04,4.7,10892
716,"Health, Fitness & Dieting",The Obesity Code: Unlocking the Secrets of Weight Loss (The Wellness Code (Book 1)),Dr. Jason Fung,2016-03-01,4.6,10716
717,"Health, Fitness & Dieting",The Untethered Soul: The Journey Beyond Yourself,Michael A. Singer,2007-10-03,4.7,10518
718,"Health, Fitness & Dieting",The 48 Laws of Power,Robert Greene,2000-09-01,4.7,10457
719,History,How to Be an Antiracist,Ibram X. Kendi,2019-08-13,4.8,11890
720,History,Killing Jesus (Bill O'Reilly's Killing Series),Bill O'Reilly,2013-09-24,4.5,11461
721,History,Killing Patton: The Strange Death of World War II's Most Audacious General (Bill O'Reilly's Killing Series),Bill O'Reilly,2014-09-23,4.6,10973
722,History,Between the World and Me,Ta-Nehisi Coates,2015-09-08,4.7,10919
723,History,Alexander Hamilton,Ron Chernow,2004-04-26,4.8,10043
724,History,Disloyal: A Memoir: The True Story of the Former Personal Attorney to President Donald J. Trump,Michael Cohen,2020-09-08,4.6,9894
725,History,Astrophysics for People in a Hurry,Neil deGrasse Tyson,2017-05-02,4.7,9823
726,History,The Immortal Life of Henrietta Lacks,Rebecca Skloot,2011-03-08,4.7,9671
727,History,Extreme Ownership: How U.S. Navy SEALs Lead and Win (New Edition),Jocko Willink,2017-11-21,4.8,9501
728,History,Killing Lincoln: The Shocking Assassination that Changed America Forever (Bill O'Reilly's Killing Series),Bill O'Reilly,2015-09-01,4.7,9396
729,History,Killing the Rising Sun: How America Vanquished World War II Japan (Bill O'Reilly's Killing Series),Bill O'Reilly,2016-09-13,4.8,9015
730,History,Killers of the Flower Moon: The Osage Murders and the Birth of the FBI,David Grann,2018-04-03,4.6,8735
731,History,Killing Kennedy: The End of Camelot,Bill O'Reilly,2012-10-02,4.6,8693
732,History,Meditations (Everyman's Library Classics Series),Marcus Aurelius,1992-06-02,4.6,8319
733,History,I Know Why the Caged Bird Sings,Maya Angelou,2002-03-05,4.8,8277
734,History,"Elon Musk: Tesla, SpaceX, and the Quest for a Fantastic Future",Ashlee Vance,2017-01-24,4.7,8189
735,Humor & Entertainment,"I Am Confident, Brave & Beautiful: A Coloring Book for Girls",Hopscotch Girls,2017-11-13,4.8,10604
736,Humor & Entertainment,Animal Farm,George Orwell,2003-05-06,4.7,10367
737,Humor & Entertainment,Go the F**k to Sleep,Adam Mansbach,2011-06-14,4.8,10130
738,Humor & Entertainment,Strange Planet (Strange Planet Series),Nathan W. Pyle,2019-11-19,4.9,9886
739,Humor & Entertainment,Wacky Waving Inflatable Tube Guy (RP Minis),Conor Riordan,2018-10-02,4.7,9865
740,Humor & Entertainment,Zen as F*ck (Zen as F*ck Journals),Monica Sweeney,2018-03-06,4.7,9864
741,Humor & Entertainment,Fucking Adorable - Cute Critters with foul Mouths,Heather Land,2016-09-05,4.7,9849
742,Humor & Entertainment,"Dungeons & Dragons Dungeon Master's Guide (Core Rulebook, D&D Roleplaying Game)",Wizards RPG Team,2014-12-09,4.8,9832
743,Humor & Entertainment,What If?: Serious Scientific Answers to Absurd Hypothetical Questions,Randall Munroe,2014-09-02,4.7,9673
744,Humor & Entertainment,The 7 Habits of Highly Effective People: 30th Anniversary Card Deck (The Official 7 Habits Card Deck),Stephen R. Covey,2019-07-02,4.6,9656
745,Humor & Entertainment,"Secret Garden: An Inky Treasure Hunt and Coloring Book (For Adults, mindfulness coloring)",Johanna Basford,2013-03-26,4.7,9642
746,Humor & Entertainment,The Casual Vacancy,J. K. Rowling,2013-07-23,4.7,9445
747,Humor & Entertainment,"Adult Coloring Book : Stress Relieving Designs Animals, Mandalas, Flowers, Paisley Patterns And So Much More: Coloring Book For Adults",Cindy Elsharouni,2017-11-17,4.6,9382
748,Humor & Entertainment,The Day The Crayons Quit,Drew Daywalt,2016-02-25,4.8,9313
749,Humor & Entertainment,"Dungeons & Dragons Monster Manual (Core Rulebook, D&D Roleplaying Game)",Wizards RPG Team,2014-09-30,4.8,9258
750,Humor & Entertainment,Pocket Rider Waite Tarot,Arthur Edward Waite,2012-03-05,4.8,8806
751,Law,"Philomena (Movie Tie-In): A Mother, Her Son, and a Fifty-Year Search",Martin Sixsmith,2013-11-06,4.7,3323
752,Law,The Innocent Man: Murder and Injustice in a Small Town,John Grisham,2012-03-27,4.4,3220
753,Law,The Original Rider-Waite Tarot Set,Arthur Edward Waite,2012-05-23,4.6,3156
754,Law,The Souls of Black Folk by W.E.B. Du Bois,W.E.B. Du Bois,2020-01-14,4.7,3130
755,Law,The Adventures of Sherlock Holmes,Sir Arthur Conan Doyle,2020-02-04,4.5,3070
756,Law,"Walden, and On the Duty of Civil Disobedience",Henry David Thoreau,2020-06-11,4.4,2984
757,Law,Fuck This Shit Show: A Gratitude Journal for Tired-Ass Women: Funny Swearing Gifts | Gag Gifts for Women | Small Gifts for Sisters and Best Friends (Cuss Words Make Me Happy),Crazy Tired Beetches,2018-12-16,4.7,2869
758,Law,The Federalist Papers,Alexander Hamilton,1982-01-01,4.7,2847
759,Law,The Secret Barrister: Stories of the Law and How It's Broken,Secret Barrister,2018-07-01,4.4,2776
760,Law,SUN TZU THE ART OF WAR: 2019 NEW EDITION,Sun Tzu,2019-05-17,4.4,2767
761,Law,My Beloved World,Sonia Sotomayor,2014-01-07,4.6,2751
762,Law,"The Monuments Men: Allied Heroes, Nazi Thieves and the Greatest Treasure Hunt in History",Robert M. Edsel,2010-09-17,4.4,2680
763,Law,Common Sense,Thomas Paine,2017-02-16,4.7,2423
764,Law,The Bully Pulpit: Theodore Roosevelt and the Golden Age of Journalism,Doris Kearns Goodwin,2014-09-09,4.6,2207
765,Law,The Sun Does Shine: How I Found Life and Freedom on Death Row (Oprah's Book Club Summer 2018 Selection),Anthony Ray Hinton,2018-03-27,4.8,2206
766,Law,"Why Nations Fail: The Origins of Power, Prosperity, and Poverty",James A. Robinson,2013-09-17,4.5,2194
767,"Lesbian, Gay, Bisexual & Transgender Books",Simon vs. the Homo Sapiens Agenda,Becky Albertalli,2016-06-07,4.8,3126
768,"Lesbian, Gay, Bisexual & Transgender Books","The Long Way to a Small, Angry Planet (Wayfarers)",Becky Chambers,2016-07-05,4.4,2670
769,"Lesbian, Gay, Bisexual & Transgender Books",Aristotle and Dante Discover the Secrets of the Universe,by ,2014-04-01,4.7,2643
770,"Lesbian, Gay, Bisexual & Transgender Books",Aristotle and Dante Discover the Secrets of the Universe,John Green ,2012-02-21,4.7,2643
771,"Lesbian, Gay, Bisexual & Transgender Books",Mrs Everything,Jennifer Weiner,2019-06-11,4.7,2627
772,"Lesbian, Gay, Bisexual & Transgender Books",The Picture of Dorian Gray,Oscar Wilde,2018-10-25,4.3,2592
773,"Lesbian, Gay, Bisexual & Transgender Books",The Heart's Invisible Furies: A Novel,John Boyne,2017-08-22,4.5,2578
774,"Lesbian, Gay, Bisexual & Transgender Books",The Chosen (Black Dagger Brotherhood),J. R. Ward,2017-09-26,4.8,2517
775,"Lesbian, Gay, Bisexual & Transgender Books",Child 44 (The Child 44 Trilogy (1)),Tom Rob Smith,2011-12-13,4.4,2467
776,"Lesbian, Gay, Bisexual & Transgender Books",Find Me: A Novel,André Aciman,2019-10-29,4.4,2466
777,"Lesbian, Gay, Bisexual & Transgender Books",Carry On,Rainbow Rowell,2019-07-11,4.7,2347
778,"Lesbian, Gay, Bisexual & Transgender Books",Over the Top: My Story,Jonathan Van Ness,2020-09-29,4.8,2344
779,"Lesbian, Gay, Bisexual & Transgender Books",On Earth We're Briefly Gorgeous: A Novel,Ocean Vuong,2019-06-04,4.4,2106
780,"Lesbian, Gay, Bisexual & Transgender Books",Seriously...I'm Kidding,Ellen DeGeneres,2012-09-25,4.7,2056
781,"Lesbian, Gay, Bisexual & Transgender Books",Fried Green Tomatoes at the Whistle Stop Cafe,Fannie Flagg,1987-08-12,4.7,2001
782,"Lesbian, Gay, Bisexual & Transgender Books",How to be a Woman,Caitlin Moran,2012-03-01,4.7,1959
783,Literature & Fiction,Inferno (Robert Langdon),Dan Brown,2014-05-06,4.7,29847
784,Literature & Fiction,Little Fires Everywhere: A Novel,Celeste Ng,2019-05-07,4.5,28309
785,Literature & Fiction,To Kill a Mockingbird,Harper Lee,2005-07-05,4.8,27841
786,Literature & Fiction,Outlander,Diana Gabaldon,1998-08-10,4.7,27793
787,Literature & Fiction,The Husband's Secret,Liane Moriarty,2017-06-27,4.3,27399
788,Literature & Fiction,Grey: Fifty Shades of Grey as Told by Christian (Fifty Shades of Grey Series),E L James,2015-06-18,4.4,26066
789,Literature & Fiction,The Hobbit,J R RF Tolkien,2004-10-18,4.7,16830
790,Literature & Fiction,The Hobbit and the Lord of the Rings,J. R. R. Tolkien,2011-10-01,4.7,8996
791,Literature & Fiction,Eleanor Oliphant Is Completely Fine: A Novel,Gail Honeyman,2018-06-05,4.5,24823
792,Literature & Fiction,"Harry Potter and the Cursed Child, Parts 1 & 2, Special Rehearsal Edition Script",J.K. Rowling,2016-07-31,4.7,24620
793,Literature & Fiction,A Man Called Ove: A Novel,Fredrik Backman,2015-05-05,4.6,24438
794,Literature & Fiction,Fifty Shades Darker,E L James,2012-04-17,4.4,24083
795,Literature & Fiction,The Book Thief,Markus Zusak,2007-09-11,4.6,23645
796,Literature & Fiction,Sycamore Row (The Jake Brigance),John Grisham,2014-08-19,4.5,23384
797,Literature & Fiction,1984 (Signet Classics),George Orwell,1950-07-01,4.7,23353
798,Literature & Fiction,The Tattooist of Auschwitz: A Novel,Heather Morris,2018-09-04,4.7,23089
799,Medical Books,Publication Manual of the American Psychological Association (Publication Manual of the American Psychological Association (Spiral) 6th (sixth) edition,American Psychological Association,2010-01-01,4.5,8959
800,Medical Books,"ATI TEAS Secrets Study Guide: TEAS 6 Complete Study Manual, Full-Length Practice Tests, Review Video Tutorials for the Test of Essential Academic Skills, Sixth Edition",TEAS Exam Secrets Test Prep Team,2016-03-31,4.7,7886
801,Medical Books,"Publication Manual of the American Psychological Association: 7th Edition, 2020 Copyright",American Psychological Association,2019-10-01,4.8,7124
802,Medical Books,"Diagnostic and Statistical Manual of Mental Disorders, 5th Edition: DSM-5",American Psychiatric Association,2013-05-27,4.5,6988
803,Medical Books,Twas The Nightshift Before Christmas,Adam Kay,2019-10-17,4.6,6501
804,Medical Books,Why We Sleep: Unlocking the Power of Sleep and Dreams,Matthew Walker PhD,2018-06-19,4.7,6441
805,Medical Books,Talking to Strangers: What We Should Know about the People We Don't Know,Malcolm Gladwell,2019-09-10,4.5,6441
806,Medical Books,"Grain Brain: The Surprising Truth about Wheat, Carbs, and Sugar--Your Brain's Silent Killers",David Perlmutter MD,2018-12-18,4.6,6054
807,Medical Books,Unreported Truths about COVID-19 and Lockdowns: Part 1: Introduction and Death Counts and Estimates,Alex Berenson,2020-06-04,4.6,6013
808,Medical Books,The 8-Week Blood Sugar Diet: How to Beat Diabetes Fast (and Stay Off Medication),Dr Dr Michael Mosley,2016-12-27,4.3,5963
809,Medical Books,"Medical Medium Liver Rescue: Answers to Eczema, Psoriasis, Diabetes, Strep, Acne, Gout, Bloating, Gallstones, Adrenal Stress, Fatigue, Fatty Liver, Weight Issues, SIBO & Autoimmune Disease",Anthony William,2018-10-30,4.7,5794
810,Medical Books,Factfulness: Ten Reasons We're Wrong About the World--and Why Things Are Better Than You Think,Hans Rosling,2020-04-07,4.6,5769
811,Medical Books,"Many Lives, Many Masters: The True Story of a Prominent Psychiatrist, His Young Patient, and the Past-Life Therapy That Changed Both Their Lives",Brian L. Weiss,1988-07-15,4.7,5718
812,Medical Books,The Fast Metabolism Diet: Eat More Food and Lose More Weight,Haylie Pomroy,2013-04-09,4.7,5362
813,Medical Books,"Medical Medium Thyroid Healing: The Truth behind Hashimoto's, Graves', Insomnia, Hypothyroidism, Thyroid Nodules & Epstein-Barr",Anthony William,2017-11-07,4.6,5322
814,Medical Books,Becoming Supernatural: How Common People Are Doing the Uncommon,Dr. Joe Dispenza,2019-03-05,4.8,5249
815,"Mystery, Thriller & Suspense","The Atlantis Gene: A Thriller (The Origin Mystery, Book 1)",A.G. Riddle,2013-04-05,4.7,18750
816,"Mystery, Thriller & Suspense",The Butterfly Garden (The Collector),Dot Hutchison,2016-06-01,4.4,18748
817,"Mystery, Thriller & Suspense",I Am Watching You,Teresa Driscoll,2017-10-01,4.4,18701
818,"Mystery, Thriller & Suspense",My Sister's Grave (Tracy Crosswhite),Robert Dugoni,2014-11-01,4.5,18681
819,"Mystery, Thriller & Suspense",The Cuckoo's Calling (A Cormoran Strike Novel),Robert Galbraith,2018-05-29,4.7,18543
820,"Mystery, Thriller & Suspense",The Light Between Oceans: A Novel,M. L. Stedman,2012-07-31,4.5,17903
821,"Mystery, Thriller & Suspense",Divergent / Insurgent,Veronica Roth,2012-05-01,4.5,17833
822,"Mystery, Thriller & Suspense",American Dirt (Oprah's Book Club): A Novel,Jeanine Cummins,2020-01-21,4.6,17602
823,"Mystery, Thriller & Suspense",Written In My Own Heart's Blood (Outlander (Gabaldon) (8)),Diana Gabaldon,2008-10-08,4.8,16664
824,"Mystery, Thriller & Suspense",The Woman in the Window [Movie Tie-In],A. J Finn,2020-03-31,4.4,16253
825,"Mystery, Thriller & Suspense",Doctor Sleep,Stephen King,2019-09-24,4.7,16214
826,"Mystery, Thriller & Suspense",When We Believed in Mermaids: A Novel,Barbara O'Neal,2019-07-16,4.5,15827
827,"Mystery, Thriller & Suspense",Blue Moon: A Jack Reacher Novel,Lee Child,2020-04-28,4.3,15456
828,"Mystery, Thriller & Suspense",I Am Pilgrim: A Thriller,Terry Hayes,2014-05-27,4.6,15172
829,"Mystery, Thriller & Suspense",The Girl in the Spider's Web (Millennium Series),David Lagercrantz,2017-05-16,4.7,14923
830,"Mystery, Thriller & Suspense",The Girl in the Ice (Erika Foster series (1)),Robert Bryndza,2018-04-24,4.4,14815
831,Parenting & Relationships,"Tuesdays with Morrie: An Old Man, a Young Man, and Life's Greatest Lesson, 20th Anniversary Edition",Mitch Albom,2002-10-08,4.8,7893
832,Parenting & Relationships,Hinch Yourself Happy: All The Best Cleaning Tips To Shine Your Sink And Soothe Your Soul,Mrs Hinch,2019-04-04,4.7,7723
833,Parenting & Relationships,Sisters (Turtleback School & Library Binding Edition),Raina Telgemeier,2014-08-26,4.8,7345
834,Parenting & Relationships,Codependent No More: How to Stop Controlling Others and Start Caring for Yourself,Melody Beattie,1986-09-01,4.7,7011
835,Parenting & Relationships,Mrs Hinch: The Activity Journal,Mrs Hinch,2019-10-17,4.8,6930
836,Parenting & Relationships,Teach Your Child to Read in 100 Easy Lessons,Siegfried Engelmann,1986-06-15,4.5,6410
837,Parenting & Relationships,Wolf Hall,Hilary Mantel,2009-10-13,4.7,6300
838,Parenting & Relationships,"Knock Knock What I Love about You Fill in the Love Book Fill-in-the-Blank Gift Journal, 4.5 x 3.25-Inches",Knock Knock,2015-06-15,4.7,6016
839,Parenting & Relationships,The Invisible String,Patrice Karst,2000-09-01,4.8,5877
840,Parenting & Relationships,The Glass Castle: A Memoir (Scribner Classics),Jeannette Walls,2009-10-06,4.6,5839
841,Parenting & Relationships,"Maybe You Should Talk to Someone: A Therapist, HER Therapist, and Our Lives Revealed",Lori Gottlieb,2019-04-02,4.6,5603
842,Parenting & Relationships,Why Men Love Bitches: From Doormat to Dreamgirl―A Woman's Guide to Holding Her Own in a Relationship,Sherry Argov,2002-10-01,4.7,5512
843,Parenting & Relationships,"101 So Bad, They're Good Dad Jokes",Elias Hill,2017-07-20,4.4,5450
844,Parenting & Relationships,Let's Pretend This Never Happened: A Mostly True Memoir,Jenny Lawson,2013-03-05,4.4,5435
845,Parenting & Relationships,A Child Called It: One Child's Courage to Survive,Dave Pelzer,1995-09-01,4.8,5308
846,Parenting & Relationships,"Act Like a Lady, Think Like a Man: What Men Really Think About Love, Relationships, Intimacy, and Commitment",Steve Harvey,2009-01-27,4.6,5126
847,Politics & Social Sciences,"The Boy, the Mole, the Fox and the Horse",Charlie Mackesy,2019-10-22,4.8,16044
848,Politics & Social Sciences,Hillbilly Elegy: A Memoir of a Family and Culture in Crisis,J. D. Vance,2018-05-01,4.4,15841
849,Politics & Social Sciences,Harry Potter and the Order of the Phoenix (Book 5),J.K. Rowling,2003-06-21,4.8,15231
850,Politics & Social Sciences,When Breath Becomes Air,Paul Kalanithi,2016-01-12,4.8,14217
851,Politics & Social Sciences,The Art Of War,Sun Tzu,2007-11-01,4.4,14107
852,Politics & Social Sciences,Fire and Fury: Inside the Trump White House,Michael Wolff,2019-01-08,4.7,13868
853,Politics & Social Sciences,Lone Survivor: The Eyewitness Account of Operation Redwing and the Lost Heroes of SEAL Team 10,Marcus Luttrell,2008-05-01,4.8,13826
854,Politics & Social Sciences,12 Years a Slave,Solomon Northup,2014-02-21,4.6,12545
855,Politics & Social Sciences,The Perks of Being a Wallflower,Stephen Chbosky,2012-08-14,4.6,12037
856,Politics & Social Sciences,Just Mercy: A Story of Justice and Redemption,Bryan Stevenson,2015-08-18,4.8,11928
857,Politics & Social Sciences,How to Be an Antiracist,Ibram X. Kendi,2019-08-13,4.8,11890
858,Politics & Social Sciences,Fahrenheit 451,Ray Bradbury,2012-01-10,4.6,11628
859,Politics & Social Sciences,"Thinking, Fast and Slow",Daniel Kahneman,2012-01-01,4.6,11620
860,Politics & Social Sciences,Being Mortal: Medicine and What Matters in the End,Atul Gawande,2017-09-05,4.8,11367
861,Politics & Social Sciences,The Gifts of Imperfection: 10th Anniversary Edition: Features a new foreword and brand-new tools,Brené Brown,2020-09-08,4.7,11319
862,Politics & Social Sciences,Lord of the Flies,William Golding,2003-12-16,4.6,11024
863,Reference,The Shack: Where Tragedy Confronts Eternity,William P. Young,2007-07-01,4.6,19891
864,Reference,Player's Handbook (Dungeons & Dragons),Wizards RPG Team,2014-08-19,4.8,18149
865,Reference,The Light Between Oceans,M.L. Stedman,2013-04-02,4.5,17903
866,Reference,Divergent / Insurgent,Veronica Roth,2012-05-01,4.5,17833
867,Reference,Man's Search for Meaning,Viktor E. Frankl,2006-06-01,4.7,17445
868,Reference,Wild: From Lost to Found on the Pacific Crest Trail,Cheryl Strayed,2013-03-26,4.4,17316
869,Reference,The Hobbit,J.R.R. Tolkien,2002-08-15,4.7,16830
870,Reference,The Power of Now: A Guide to Spiritual Enlightenment,Eckhart Tolle,2001-12-10,4.7,16650
871,Reference,"Brown Bear, Brown Bear, What Do You See? My First Reader",Bill Martin Jr. and Eric Carle,2010-07-20,4.9,15598
872,Reference,Giraffes Can't Dance,Giles Andreae,2012-03-01,4.8,15175
873,Reference,Go Set a Watchman: A Novel,Harper Lee,2015-07-14,4.7,15113
874,Reference,The Invention of Wings,Sue Monk Kidd,2015-05-05,4.7,14491
875,Reference,The Art Of War,Sun Tzu,2014-12-16,4.4,14107
876,Reference,Lone Survivor: The Eyewitness Account of Operation Redwing and the Lost Heroes of SEAL Team 10,Marcus Luttrell,2013-11-19,4.8,13826
877,Reference,Proof of Heaven: A Neurosurgeon's Journey into the Afterlife,Eben Alexander,2012-10-23,4.3,13700
878,Reference,Small Great Things: A Novel,Jodi Picoult,2016-10-11,4.7,13605
879,Religion & Spirituality,The Power of Now: A Guide to Spiritual Enlightenment,Eckhart Tolle,2001-12-10,4.7,16650
880,Religion & Spirituality,Heaven is for Real: A Little Boy's Astounding Story of His Trip to Heaven and Back,Todd Burpo,2010-10-31,4.7,15856
881,Religion & Spirituality,You are a Badass (Deluxe Edition): How to Stop Doubting Your Greatness and Start Living an Awesome Life,Jen Sincero,2017-10-17,4.7,15417
882,Religion & Spirituality,The Art of War,Sun Tzu,2005-01-11,4.4,14107
883,Religion & Spirituality,Proof of Heaven: A Neurosurgeon's Journey into the Afterlife,Eben Alexander,2012-10-23,4.3,13700
884,Religion & Spirituality,The Total Money Makeover: Classic Edition: A Proven Plan for Financial Fitness,Dave Ramsey,2013-09-17,4.7,12376
885,Religion & Spirituality,"Prayer Journal for Women: 52 Week Scripture, Devotional & Guided Prayer Journal",Shannon Roberts,2019-03-14,4.8,12051
886,Religion & Spirituality,The Harbinger: The Ancient Mystery That Holds the Secret of America's Future,Jonathan Cahn,2011-01-01,4.6,11526
887,Religion & Spirituality,Killing Jesus (Bill O'Reilly's Killing Series),Bill O'Reilly,2013-09-24,4.5,11461
888,Religion & Spirituality,The Gifts of Imperfection: Let Go of Who You Think You're Supposed to Be and Embrace Who You Are,Brené Brown,2010-08-27,4.7,11319
889,Religion & Spirituality,A Christmas Carol and Other Christmas Writings (Penguin Clothbound Classics),Charles Dickens,2010-09-28,4.6,10697
890,Religion & Spirituality,The Untethered Soul: The Journey Beyond Yourself,Michael A. Singer,2007-10-03,4.7,10518
