,CATEGORY,TITLE,AUTHOR,DATE,STAR,RATING
891,Religion & Spirituality,Animal Farm,George Orwell,2020-06-05,4.7,10367
892,Religion & Spirituality,The Richest Man in Babylon,George S. Clason,2002-01-01,4.7,9883
893,Religion & Spirituality,"Relationship Goals: How to Win at Dating, Marriage, and Sex",Michael Todd,2020-04-28,4.9,9697
894,Religion & Spirituality,The Day The Crayons Quit,Drew Daywalt,2016-02-25,4.8,9313
895,Romance,Everything We Keep: A Novel,Kerry Lonsdale,2016-08-01,4.7,13711
896,Romance,The Giver of Stars: A Novel,Jojo Moyes,2019-10-08,4.6,13332
897,Romance,Pride and Prejudice,Jane Austen,2002-12-31,4.5,12957
898,Romance,A Shade Of Vampire,Bella Forrest,2012-12-17,4.3,12849
899,Romance,Where the Forest Meets the Stars,Glendy Vanderah,2019-03-01,4.6,12556
900,Romance,"Dragonfly in Amber (Outlander, Book 2)",Diana Gabaldon,2001-08-07,4.7,12482
901,Romance,Twilight,Stephenie Meyer,2005-10-05,4.7,12290
902,Romance,Craving (1) (Steel Brothers Saga),Helen Hardt,2016-05-03,4.7,12088
903,Romance,The Great Gatsby,F. Scott Fitzgerald,2020-06-30,4.4,11990
904,Romance,The Great Gatsby: (Penguin Classics Deluxe Edition),F. Scott Fitzgerald,2021-01-05,4.4,11990
905,Romance,The Letter,Kathryn Hughes,2016-04-05,4.5,11272
906,Romance,A Discovery of Witches (All Souls Series),Deborah Harkness,2011-12-27,4.5,11198
907,Romance,Voyager: A Novel (Outlander) (Mass Market Paperback),Diana Gabaldon,1994-10-01,4.8,11093
908,Romance,Wuthering Heights (Penguin Classics),Emily Brontë,2002-12-31,4.4,11046
909,Romance,The Night Circus,Erin Morgenstern,2012-07-03,4.4,10833
910,Romance,The Longest Ride,Nicholas Sparks,2014-09-30,4.6,10829
911,Science & Math,"Things That Matter: Three Decades of Passions, Pastimes and Politics [Deckled Edge]",Charles Krauthammer,2013-10-22,4.7,7087
912,Science & Math,"The Atlantis Plague: A Thriller (The Origin Mystery, Book 2)",A.G. Riddle,2013-11-18,4.4,7074
913,Science & Math,Whose Boat Is This Boat?: Comments That Don't Help in the Aftermath of a Hurricane,The Staff of The Late Show with Stephen Colbert,2018-11-06,4.6,6939
914,Science & Math,Homo Deus: A Brief History of Tomorrow,Yuval Noah Harari,2018-09-04,4.6,6935
915,Science & Math,"Preschool Math Workbook for Toddlers Ages 2-4: Beginner Math Preschool Learning Book with Number Tracing and Matching Activities for 2, 3 and 4 year olds and kindergarten prep",Modern Kid Press,2019-10-29,4.7,6678
916,Science & Math,Twas The Nightshift Before Christmas,Adam Kay,2019-10-17,4.6,6501
917,Science & Math,Why We Sleep: Unlocking the Power of Sleep and Dreams,Matthew Walker PhD,2018-06-19,4.7,6441
918,Science & Math,The War of Art: Break Through the Blocks and Win Your Inner Creative Battles,Steven Pressfield,2003-04-01,4.5,6420
919,Science & Math,A Brief History of Time,Stephen Hawking,1998-09-01,4.6,6308
920,Science & Math,The Wright Brothers,David McCullough,2016-05-03,4.7,6220
921,Science & Math,A Walk in the Woods: Rediscovering America on the Appalachian Trail,Bill Bryson,2006-12-26,4.5,6189
922,Science & Math,A Walk in the Woods: Rediscovering America on the Appalachian Trail (Official Guides to the Appalachian Trail),Bill Bryson,1999-05-04,4.5,6189
923,Science & Math,Crystals for Beginners: The Guide to Get Started with the Healing Power of Crystals,Karen Frazier,2017-10-17,4.8,6126
924,Science & Math,The God Delusion,Richard Dawkins,2008-01-16,4.5,6069
925,Science & Math,A Short History of Nearly Everything,Bill Bryson,2004-09-14,4.6,5859
926,Science & Math,Factfulness: Ten Reasons We're Wrong About the World--and Why Things Are Better Than You Think,Hans Rosling,2020-04-07,4.6,5769
927,Science Fiction & Fantasy,Wool,Hugh Howey,2013-03-12,4.6,15710
928,Science Fiction & Fantasy,Harry Potter and the Deathly Hallows CD (Harry Potter 7),J.K. Rowling,2016-08-11,4.8,15334
929,Science Fiction & Fantasy,The Institute: A Novel,Stephen King,2019-09-10,4.7,14525
930,Science Fiction & Fantasy,Harry Potter Box Set: The Complete Collection,J. K. Rowling,2014-11-15,4.8,14106
931,Science Fiction & Fantasy,Harry Potter and the Half-Blood Prince (Harry Potter 6),J.K. Rowling,2016-08-11,4.9,13501
932,Science Fiction & Fantasy,The Name of the Wind,Patrick Rothfuss,2007-03-27,4.7,12946
933,Science Fiction & Fantasy,A Shade Of Vampire,Bella Forrest,2012-12-17,4.3,12849
934,Science Fiction & Fantasy,A Dance with Dragons: A Song of Ice and Fire: Book Five,George R. R. Martin,2013-10-29,4.4,12834
935,Science Fiction & Fantasy,Where the Forest Meets the Stars,Glendy Vanderah,2019-03-01,4.6,12556
936,Science Fiction & Fantasy,"Dragonfly in Amber (Outlander, Book 2)",Diana Gabaldon,2001-08-07,4.7,12482
937,Science Fiction & Fantasy,Ender's Game (The Ender Quintet),Orson Scott Card,1994-07-15,4.6,11759
938,Science Fiction & Fantasy,Fahrenheit 451,Ray Bradbury,2012-01-10,4.6,11628
939,Science Fiction & Fantasy,"Dune (Dune Chronicles, Book 1)",Frank Herbert,2005-08-02,4.7,11472
940,Science Fiction & Fantasy,The Last Wish: Introducing the Witcher,Andrzej Sapkowski,2017-07-18,4.7,11303
941,Science Fiction & Fantasy,A Discovery of Witches (All Souls Series),Deborah Harkness,2011-12-27,4.5,11198
942,Science Fiction & Fantasy,The Testaments: A Novel (The Handmaid's Tale),Margaret Atwood,2020-09-01,4.6,11162
943,Self-Help,The Power of Now: A Guide to Spiritual Enlightenment,Eckhart Tolle,2001-12-10,4.7,16650
944,Self-Help,"The Boy, the Mole, the Fox and the Horse",Charlie Mackesy,2019-10-22,4.8,16044
945,Self-Help,Heaven is for Real: A Little Boy's Astounding Story of His Trip to Heaven and Back,Todd Burpo,2010-10-31,4.7,15856
946,Self-Help,You Are a Badass: How to Stop Doubting Your Greatness and Start Living an Awesome Life,Jen Sincero,2013-04-23,4.7,15417
947,Self-Help,The Art Of War,Sun Tzu,2007-11-01,4.4,14107
948,Self-Help,Atomic Habits: An Easy & Proven Way to Build Good Habits & Break Bad Ones,James Clear,2018-10-16,4.8,13932
949,Self-Help,Burn After Writing,Sharon Jones,2015-08-04,4.6,12581
950,Self-Help,"Thinking, Fast and Slow",Daniel Kahneman,2012-01-01,4.6,11620
951,Self-Help,Being Mortal: Medicine and What Matters in the End,Atul Gawande,2017-09-05,4.8,11367
952,Self-Help,The Gifts of Imperfection: Let Go of Who You Think You're Supposed to Be and Embrace Who You Are,Brené Brown,2010-08-27,4.7,11319
953,Self-Help,The Power of Habit: Why We Do What We Do in Life and Business,Charles Duhigg,2014-01-07,4.6,11146
954,Self-Help,Outliers: The Story of Success,Malcolm Gladwell,2011-06-07,4.6,10956
955,Self-Help,Good Days Start With Gratitude: A 52 Week Guide To Cultivate An Attitude Of Gratitude: Gratitude Journal,Pretty Simple Press,2017-09-16,4.6,10977
956,Self-Help,Make Your Bed: Little Things That Can Change Your Life...And Maybe the World,Admiral William H. McRaven,2017-04-04,4.7,10892
957,Self-Help,The Untethered Soul: The Journey Beyond Yourself,Michael A. Singer,2007-10-03,4.7,10518
958,Self-Help,The 48 Laws of Power,Robert Greene,2000-09-01,4.7,10457
959,Sports & Outdoors,Into Thin Air: A Personal Account of the Mt. Everest Disaster,Jon Krakauer,1999-10-19,4.7,4583
960,Sports & Outdoors,Majestic Bible Tabs: Traditional Gold-Edged Large Print,Ellie Claire,2008-09-01,4.6,4200
961,Sports & Outdoors,"Happy, Happy, Happy: My Life and Legacy as the Duck Commander",Phil Robertson,2013-05-07,4.8,4187
962,Sports & Outdoors,Endurance: Shackleton's Incredible Voyage,Alfred Lansing,2015-04-28,4.8,4063
963,Sports & Outdoors,Ben Hogan's Five Lessons: The Modern Fundamentals of Golf,Ben Hogan,1985-09-20,4.8,3961
964,Sports & Outdoors,Creative Haven Owls Coloring Book (Adult Coloring),Marjorie Sarnat,2015-06-17,4.8,3942
965,Sports & Outdoors,Majestic Rose Nouveau Bible Tabs,Ellie Claire,2008-07-01,4.7,3922
966,Sports & Outdoors,The Salt Path: A Memoir,Raynor Winn,2019-03-05,4.5,3787
967,Sports & Outdoors,Open: An Autobiography,Andre Agassi,2010-08-10,4.7,3750
968,Sports & Outdoors,The Dangerous Book for Boys,Conn Iggulden,2012-04-24,4.7,3677
969,Sports & Outdoors,"The New Encyclopedia of Modern Bodybuilding : The Bible of Bodybuilding, Fully Updated and Revised",Arnold Schwarzenegger,1999-11-05,4.8,3640
970,Sports & Outdoors,Unnatural Causes,Richard Shepherd,2019-08-01,4.7,3605
971,Sports & Outdoors,Majestic Bible Tabs Lavender,Ellie Claire,2009-02-01,4.7,3580
972,Sports & Outdoors,The MeatEater Fish and Game Cookbook: Recipes and Techniques for Every Hunter and Angler,Steven Rinella,2018-11-20,4.9,3538
973,Sports & Outdoors,T is for Turbo: ABC Book (Motorhead Garage Series),Michael J. Myers,2018-05-30,4.8,3396
974,Sports & Outdoors,Free Country: A Penniless Adventure the Length of Britain,George Mahood,2014-12-18,4.5,3368
975,Teen & Young Adult,Jesus Calling (Teen Cover): Enjoy Peace in His Presence (with Scripture References),Sarah Young,2012-10-08,4.9,20115
976,Teen & Young Adult,The Shack: Where Tragedy Confronts Eternity,William P. Young,2007-07-01,4.6,19891
977,Teen & Young Adult,Insurgent (Divergent Series),Veronica Roth,2015-01-20,4.5,17833
978,Teen & Young Adult,Man's Search for Meaning: Young Adult Edition,Viktor E. Frankl,2017-04-25,4.7,17445
979,Teen & Young Adult,The Hunger Games Trilogy: The Hunger Games / Catching Fire / Mockingjay,Suzanne Collins,2014-06-24,4.8,17376
980,Teen & Young Adult,The Hobbit,J.R.R. Tolkien,1986-07-12,4.7,16830
981,Teen & Young Adult,Harry Potter and the Deathly Hallows (Book 7),J. K. Rowling,2009-07-07,4.8,15334
982,Teen & Young Adult,Harry Potter And The Order Of The Phoenix,J.K. Rowling,2004-08-10,4.8,15231
983,Teen & Young Adult,The Girl in the Ice (Erika Foster series (1)),Robert Bryndza,2018-04-24,4.4,14815
984,Teen & Young Adult,Harry Potter And The Prisoner Of Azkaban,J.K. Rowling,2001-09-11,4.9,14248
985,Teen & Young Adult,Harry Potter And The Goblet Of Fire,J.K. Rowling,2002-07-30,4.9,14144
986,Teen & Young Adult,Harry Potter Paperback Box Set (Books 1-7),J. K. Rowling,2009-07-01,4.8,14106
987,Teen & Young Adult,Harry Potter and the Half-Blood Prince (Book 6),J.K. Rowling,2006-07-25,4.9,13501
988,Teen & Young Adult,Pride and Prejudice (Collector's Edition) (Wordsworth Collector's Editions),Jane Austen,2019-09-15,4.5,12957
989,Teen & Young Adult,"The Name of the Wind (Kingkiller Chronicles, Day 1)",Patrick Rothfuss,2009-04-07,4.7,12946
990,Teen & Young Adult,A Shade Of Vampire,Bella Forrest,2012-12-17,4.3,12849
991,Test Preparation,Official SAT Study Guide 2020 Edition,The College Board,2019-05-07,4.6,4580
992,Test Preparation,"School Zone - Preschool Scholar Workbook - 64 Pages, Ages 3 to 5, Preschool to Kindergarten, Reading Readiness, Early Math, Science, ABCs, Writing, and More (Deluxe Edition 64-Page)",School Zone,2014-01-01,4.7,4534
993,Test Preparation,"Scissor Skills Preschool Workbook for Kids: A Fun Cutting Practice Activity Book for Toddlers and Kids ages 3-5: Scissor Practice for Preschool ... 40 Pages of Fun Animals, Shapes and Patterns",Modern Kid Press,2019-05-16,4.7,3678
994,Test Preparation,Hamlet (Case Studies in Contemporary Criticism),William Shakespeare,1993-11-15,4.5,3553
995,Test Preparation,The Scarlet Letter (Dover Thrift Study Edition),Nathaniel Hawthorne,2009-08-03,4.4,3546
996,Test Preparation,My Kindergarten Workbook: 101 Games and Activities to Support Kindergarten Skills (My Workbooks),Brittany Lynch,2019-07-30,4.8,3434
997,Test Preparation,"Phonics for Kindergarten, Grade K (Home Workbook)",Carson-Dellosa Publishing,2010-01-04,4.7,3422
998,Test Preparation,"100 Write-and-Learn Sight Word Practice Pages: Engaging Reproducible Activity Pages That Help Kids Recognize, Write, and Really LEARN the Top 100 High-Frequency Words That are Key to Reading Success",Scholastic Teaching Resources,2002-02-01,4.7,3401
999,Test Preparation,Writing Workbook: Ages 3-5 (Collins Easy Learning Preschool),Collins UK,2016-02-02,4.7,3172
1000,Test Preparation,Handwriting Practice Paper: 100 Blank Writing Pages - For Students Learning to Write Letters,Penman Ship,2019-04-01,4.7,3161
1001,Test Preparation,"Unlimited Memory: How to Use Advanced Learning Strategies to Learn Faster, Remember More and be More Productive",Kevin Horsley,2016-03-28,4.5,3119
1002,Test Preparation,Heart of Darkness Thrift Study Edition (Dover Thrift Study Edition),Joseph Conrad,2009-08-03,4.7,3072
1003,Test Preparation,Saunders Comprehensive Review for the NCLEX-RN Examination,Linda Anne Silvestri PhD RN FAAN and Angela Elizabeth Silvestri PhD APRN FNP-BC CNE,2019-10-07,4.8,3044
1004,Test Preparation,Why Does He Do That?: Inside the Minds of Angry and Controlling Men,Lundy Bancroft,2003-09-02,4.7,2964
1005,Test Preparation,"Humble Math - 100 Days of Timed Tests: Multiplication: Grades 3-5, Math Drills, Digits 0-12, Reproducible Practice Problems",Humble Math,2019-02-07,4.8,2949
1006,Test Preparation,"School Zone - Preschool Basics Workbook - 64 Pages, Ages 3 to 5, Colors, Numbers, Counting, Matching, Classifying, Beginning Sounds, and More (School ... Workbook Series) (Deluxe Edition 64-Page)",School Zone,2015-01-01,4.7,2915
1007,Travel,The Road to Little Dribbling: Adventures of an American in Britain,Bill Bryson,2016-01-19,4.7,4058
1008,Travel,Majestic Rose Nouveau Bible Tabs,Ellie Claire,2008-07-01,4.7,3922
1009,Travel,Less (Winner of the Pulitzer Prize): A Novel,Andrew Sean Greer,2018-07-17,4.7,3790
1010,Travel,The Salt Path: A Memoir,Raynor Winn,2019-03-05,4.5,3787
1011,Travel,The Golem and the Jinni: A Novel,Helene Wecker,2013-04-23,4.5,3655
1012,Travel,Tall Tales and Wee Stories,Billy Connolly,2019-10-29,4.7,3561
1013,Travel,Free Country: A Penniless Adventure the Length of Britain,George Mahood,2014-12-18,4.5,3368
1014,Travel,Zen and the Art of Motorcycle Maintenance: An Inquiry Into Values,Robert M Pirsig,2005-08-02,4.4,3275
1015,Travel,AWOL on the Appalachian Trail,David Miller,2010-10-18,4.5,3206
1016,Travel,"The Day the World Came to Town: 9/11 in Gander, Newfoundland",Jim DeFede,2003-08-14,4.7,3093
1017,Travel,Midnight in Chernobyl: The Untold Story of the World's Greatest Nuclear Disaster,Adam Higginbotham,2020-02-04,4.8,3053
1018,Travel,"My Best Toddler Coloring Book - Fun with Numbers, Letters, Shapes, Colors, Animals: Big Activity Workbook for Toddlers & Kids",Happy Toddlerz,2019-06-21,4.8,3033
1019,Travel,Walden (AmazonClassics Edition),Henry David Thoreau,2017-07-18,4.4,2984
1020,Travel,Easy Spanish Phrase Book NEW EDITION: Over 700 Phrases for Everyday Use (Dover Language Guides Spanish),Dr. Pablo Garcia Loaeza,2013-02-21,4.4,2972
1021,Travel,Humans of New York : Stories,Brandon Stanton,2015-10-13,4.9,2893
1022,Travel,"National Geographic Road Atlas 2021: Adventure Edition [United States, Canada, Mexico]",National Geographic Maps,2020-08-25,4.8,2489
1023,Arts & Photography,Howard Stern Comes Again,Howard Stern,2019-05-14,4.3,5499
1024,Arts & Photography,Frankenstein,Mary Shelley,2020-07-07,4.5,5449
1025,Arts & Photography,"Go F*ck Yourself, I'm Coloring: Swear Word Coloring Book",Alex Fleming,2016-06-20,4.6,5434
1026,Arts & Photography,"100 Flowers: An Adult Coloring Book with Bouquets, Wreaths, Swirls, Patterns, Decorations, Inspirational Designs, and Much More!",Jade Summer,2020-01-16,4.7,5204
1027,Arts & Photography,The Ride of a Lifetime: Lessons Learned from 15 Years as CEO of the Walt Disney Company (Random House Large Print),Robert Iger,2019-10-01,4.8,4970
1028,Arts & Photography,Q&A a Day: 5-Year Journal,Potter Gift,2010-11-23,4.7,4958
1029,Arts & Photography,"NIV, Journal the Word Bible, Leathersoft, Brown: Reflect, Journal, or Create Art Next to Your Favorite Verses",Zondervan,2016-09-06,4.6,4951
1030,Arts & Photography,People of Walmart.com Adult Coloring Book: Rolling Back Dignity (OFFICIAL People of Walmart Coloring Books),Day Drankin' Press,2016-09-30,4.7,4945
1031,Arts & Photography,Romeo and Juliet (Folger Shakespeare Library),William Shakespeare,2004-07-27,4.6,4932
1032,Arts & Photography,The Picture of Dorian Gray (Vintage Classics),Oscar Wilde,2011-07-26,4.4,4876
1033,Arts & Photography,Is Everyone Hanging Out Without Me? (And Other Concerns),Mindy Kaling,2011-11-01,4.4,4870
1034,Arts & Photography,Open Book,Jessica Simpson,2020-02-04,4.7,4760
1035,Arts & Photography,Stunning Digital Photography,Tony Northrup,2019-12-01,4.7,4744
1036,Arts & Photography,The Anatomy Coloring Book,Wynn Kapit,2013-03-27,4.6,4737
1037,Arts & Photography,"Wreck This Journal: To Create is to Destroy, Now With Even More Ways to Wreck!",Keri Smith,2013-04-22,4.7,4729
1038,Arts & Photography,Teach Yourself to Play Guitar: A Quick and Easy Introduction for Beginners,David M. Brewster,2004-04-01,4.4,4462
1039,Biographies & Memoirs,The 48 Laws of Power,Robert Greene,2000-09-01,4.7,10448
1040,Biographies & Memoirs,Me: Elton John Official Autobiography,Elton John,2019-10-15,4.8,10084
1041,Biographies & Memoirs,Alexander Hamilton,Ron Chernow,2005-03-29,4.8,10032
1042,Biographies & Memoirs,Disloyal: A Memoir: The True Story of the Former Personal Attorney to President Donald J. Trump,Michael Cohen,2020-09-08,4.6,9769
1043,Biographies & Memoirs,The Immortal Life of Henrietta Lacks,Rebecca Skloot,2011-03-08,4.7,9667
1044,Biographies & Memoirs,Extreme Ownership: How U.S. Navy SEALs Lead and Win (New Edition),Jocko Willink,2017-11-21,4.8,9487
1045,Biographies & Memoirs,Killing Lincoln: The Shocking Assassination that Changed America Forever (Bill O'Reilly's Killing Series),Bill O'Reilly,2011-09-27,4.7,9394
1046,Biographies & Memoirs,A Street Cat Named Bob: And How He Saved My Life,James Bowen,2014-10-07,4.8,8954
1047,Biographies & Memoirs,Killers of the Flower Moon: The Osage Murders and the Birth of the FBI,David Grann,2018-04-03,4.6,8732
1048,Biographies & Memoirs,Shoe Dog,Phil Knight,2016-04-26,4.8,8724
1049,Biographies & Memoirs,Killing Kennedy: The End of Camelot,Bill O'Reilly,2012-10-02,4.6,8690
1050,Biographies & Memoirs,Meditations (Dover Thrift Editions),Marcus Aurelius,1997-07-11,4.6,8307
1051,Biographies & Memoirs,I Know Why the Caged Bird Sings,Maya Angelou,2009-04-21,4.8,8263
1052,Biographies & Memoirs,The Mamba Mentality: How I Play,Kobe Bryant,2018-10-23,4.9,8253
1053,Biographies & Memoirs,"Elon Musk: Tesla, SpaceX, and the Quest for a Fantastic Future",Ashlee Vance,2017-01-24,4.7,8177
1054,Biographies & Memoirs,No Easy Day: The Autobiography of a Navy Seal: The Firsthand Account of the Mission That Killed Osama Bin Laden,Mark Owen,2012-09-04,4.6,8168
1055,Business & Money,Trump: The Art of the Deal,Donald J. Trump,2015-10-06,4.6,6378
1056,Business & Money,"Red Notice: A True Story of High Finance, Murder, and One Man's Fight for Justice",Bill Browder,2015-10-20,4.8,6362
1057,Business & Money,As A Man Thinketh,James Allen,2019-03-13,4.7,6302
1058,Business & Money,"Lean In: Women, Work, and the Will to Lead",Sheryl Sandberg,2013-03-11,4.5,6210
1059,Business & Money,Official Highway Code,The Driver and Vehicle Standards Agency The Driver and Vehicle Standards Agency,2015-06-01,4.7,6069
1060,Business & Money,So You Want to Talk About Race,Ijeoma Oluo,2019-09-24,4.8,6026
1061,Business & Money,"Zero to One: Notes on Startups, or How to Build the Future",Peter Thiel,2014-09-16,4.6,5964
1062,Business & Money,Permanent Record,Edward Snowden,2019-09-17,4.8,5960
1063,Business & Money,"The Daily Stoic: 366 Meditations on Wisdom, Perseverance, and the Art of Living",Ryan Holiday,2016-10-18,4.8,5940
1064,Business & Money,The ONE Thing: The Surprisingly Simple Truth Behind Extraordinary Results,Gary Keller,2013-04-01,4.7,5921
1065,Business & Money,"The Chimp Paradox: The Mind Management Program to Help You Achieve Success, Confidence, and Happine ss",Dr. Steve Peters,2013-05-30,4.6,5896
1066,Business & Money,The Miracle Morning: The Not-So-Obvious Secret Guaranteed to Transform Your Life (Before 8AM),Hal Elrod,2012-12-07,4.6,5873
1067,Business & Money,Mindset: The New Psychology of Success,Carol S. Dweck,2007-12-26,4.6,5841
1068,Business & Money,The Lean Startup: How Today's Entrepreneurs Use Continuous Innovation to Create Radically Successful Businesses,Eric Ries,2011-09-13,4.5,5828
1069,Business & Money,Factfulness: Ten Reasons We're Wrong About the World--and Why Things Are Better Than You Think,Hans Rosling,2020-04-07,4.6,5762
1070,Business & Money,"5 AM Club, The: Own Your Morning. Elevate Your Life.",Robin Sharma,2020-01-07,4.5,5736
1071,Calendars,2020 Amy Knapp's The Very Busy Planner: August 2019-December 2020,Amy Knapp,2019-05-01,4.6,887
1072,Calendars,2019 Amy Knapp's The Very Busy Planner: August 2018-December 2019,Amy Knapp,2018-05-01,4.6,887
1073,Calendars,Zombie Survival Guide: 2011 Day-to-Day Calendar,LLC Andrews McMeel Publishing,2010-08-30,4.3,867
1074,Calendars,Sierra Club Engagement Calendar 2021,Sierra Club,2020-07-28,4.8,862
1075,Calendars,Sierra Club Wilderness Calendar 2021,Sierra Club,2020-07-28,4.8,862
1076,Calendars,Sierra Club Wilderness Calendar 2020,Sierra Club,2019-07-23,4.8,862
1077,Calendars,Sierra Club Engagement Calendar 2020,Sierra Club,2019-07-23,4.8,862
1078,Calendars,2021 Amy Knapp's Family Organizer: August 2020-December 2021,Amy Knapp,2020-05-12,4.7,858
1079,Calendars,2020 Amy Knapp's Family Organizer: August 2019-December 2020,Amy Knapp,2019-05-01,4.7,858
1080,Calendars,2019 Amy Knapp's Family Organizer: August 2018-December 2019,Amy Knapp,2018-05-01,4.7,858
1081,Calendars,Mary Engelbreit 2020 Day-to-Day Calendar: Do the Breit Thing,Mary Engelbreit,2019-05-21,4.9,830
1082,Calendars,FORTNITE (OFFICIAL): 2019 Calendar,Epic Games,2018-11-27,4.7,828
1083,Calendars,Thomas Kinkade: The Disney Dreams Collection 2018 Wall Calendar,Thomas Kinkade,2017-05-30,4.8,827
1084,Calendars,Thomas Kinkade: The Disney Dreams Collection 2018 Engagement Calendar (The Disney Dream Collection),Thomas Kinkade,2017-06-20,4.8,827
1085,Calendars,F in Exams 2018 Daily Calendar: 365 Days of the Very Best Totally Wrong Test Answers.,Richard Benson,2017-08-01,4.3,824
1086,Calendars,Life Hacks 2020 Day-to-Day Calendar,Keith Bradford,2019-06-18,4.7,821
1087,Children's Books,"Twilight (The Twilight Saga, Book 1)",Stephenie Meyer,2005-09-27,4.7,12274
1088,Children's Books,"Last Week Tonight with John Oliver Presents A Day in the Life of Marlon Bundo (Better Bundo Book, LGBT Children s Book)",Jill Twiss,2018-03-18,4.9,12095
1089,Children's Books,Chicka Chicka Boom Boom (Board Book),John Archambault,2012-08-28,4.8,12078
1090,Children's Books,P is for Potty! (Sesame Street) (Lift-the-Flap),Naomi Kleinberg,2014-07-22,4.7,11845
1091,Children's Books,"Ender's Game (The Ender Quintet, 1)",Orson Scott Card,2014-03-04,4.6,11753
1092,Children's Books,Dear Zoo: A Lift-the-Flap Book,Rod Campbell,2007-05-08,4.8,11661
1093,Children's Books,The Giving Tree,Shel Silverstein,2010-12-02,4.9,11587
1094,Children's Books,The Giver (1) (Giver Quartet),Lois Lowry,2014-07-01,4.6,11493
1095,Children's Books,Corduroy,Don Freeman,2014-10-16,4.9,4956
1096,Children's Books,The Pigeon HAS to Go to School!,Mo Willems,2019-08-01,4.8,6213
1097,Children's Books,Where the Wild Things Are,Maurice Sendak,2012-12-26,4.8,10947
1098,Children's Books,A Christmas Carol (Holiday Classics Illustrated by P.j. Lynch),Charles Dickens,2006-09-12,4.6,10687
1099,Children's Books,"I Am Confident, Brave & Beautiful: A Coloring Book for Girls",Hopscotch Girls,2017-11-13,4.8,10598
1100,Children's Books,Percy Jackson and the Olympians 5 Book Paperback Boxed Set (new covers w/poster) (Percy Jackson & the Olympians),Rick Riordan,2014-06-03,4.9,10558
1101,Children's Books,The Pout-Pout Fish,Deborah Diesen,2013-08-06,4.8,10513
1102,Children's Books,"Carson Dellosa | Colors and Shapes Flash Cards | Preschool, 54ct",Brighter Child,2006-03-15,4.7,10459
1103,Christian Books & Bibles,Little Women,Louisa May Alcott,2017-02-07,4.5,6486
1104,Christian Books & Bibles,Know Your Bible: All 66 Books Explained and Applied (Value Books),Paul Kent,2008-02-01,4.5,6312
1105,Christian Books & Bibles,As a Man Thinketh: Keepsake Edition,James Allen,2009-10-29,4.7,6302
1106,Christian Books & Bibles,Mere Christianity,C. S. Lewis,2015-04-21,4.8,6126
1107,Christian Books & Bibles,Zealot: The Life and Times of Jesus of Nazareth,Reza Aslan,2014-09-09,4.3,5825
1108,Christian Books & Bibles,The Beginner's Bible: Timeless Children's Stories,Zondervan,2016-10-04,4.8,5825
1109,Christian Books & Bibles,The Hideaway,Lauren K. Denton,2017-04-11,4.5,5662
1110,Christian Books & Bibles,The Rainbow Fish,Marcus Pfister,1999-01-27,4.8,5452
1111,Christian Books & Bibles,The Jesus Storybook Bible: Every Story Whispers His Name,Sally Lloyd-Jones,2007-02-20,4.9,5444
1112,Christian Books & Bibles,The Power of Positive Thinking,Dr. Norman Vincent Peale,1999-12-01,4.5,5345
1113,Christian Books & Bibles,The Screwtape Letters,C. S. Lewis,2015-04-21,4.7,5320
1114,Christian Books & Bibles,Love Does: Discover a Secretly Incredible Life in an Ordinary World,Bob Goff,2012-04-30,4.8,5240
1115,Christian Books & Bibles,The Purpose Driven Life: What on Earth Am I Here For?,Rick Warren,2012-11-21,4.8,5210
1116,Christian Books & Bibles,Anne of Green Gables (Radio Theatre),Paul McCusker,2007-05-01,4.6,5125
1117,Christian Books & Bibles,Slaughterhouse-Five: A Novel (Modern Library 100 Best Novels),Kurt Vonnegut,1999-01-12,4.5,4981
1118,Christian Books & Bibles,"NIV, Thinline Bible, Bonded Leather, Navy, Red Letter, Comfort Print",Zondervan,2017-11-21,4.6,4951
1119,Comics & Graphic Novels,The Time Machine (Easton Press The 100 Greatest Books Ever Written),H.G. Wells,1998-01-01,4.4,4076
1120,Comics & Graphic Novels,Watchmen (2019 Edition),Alan Moore,2019-05-20,4.8,4019
1121,Comics & Graphic Novels,The Master Guide to Drawing Anime: How to Draw Original Characters from Simple Templates (Volume 1),Christopher Hart,2015-07-07,4.7,3977
1122,Comics & Graphic Novels,Dr. Jekyll and Mr. Hyde (Bantam Classic),Robert Louis Stevenson,1982-03-01,4.4,3941
