,CATEGORY,TITLE,AUTHOR,DATE,STAR,RATING
0,Arts & Photography,The 5 Love Languages: The Secret to Love that Lasts,Gary Chapman,2015-01-01,4.8,27397
1,Arts & Photography,The Life-Changing Magic of Tidying Up: The Japanese Art of Decluttering and Organizing,Marie Kondo,2014-10-14,4.5,23167
2,Arts & Photography,Born a Crime: Stories from a South African Childhood,Trevor Noah,2019-02-12,4.8,20444
3,Arts & Photography,Born a Crime: Stories from a South African Childhood,Trevor Noah,2016-11-15,4.8,20444
4,Arts & Photography,Proof of Heaven: A Neurosurgeon's Journey into the Afterlife,Eben Alexander,2012-10-23,4.3,13695
5,Arts & Photography,Calm the F*ck Down: An Irreverent Adult Coloring Book (Irreverent Book Series),Sasha O'Hara,2016-01-06,4.6,11160
6,Arts & Photography,Wuthering Heights (Flame Tree Collectable Classics),Emily Brontë,2020-03-15,4.4,11031
7,Arts & Photography,A Christmas Carol (Calla Editions),Charles Dickens,2018-09-12,4.6,10681
8,Arts & Photography,"I Am Confident, Brave & Beautiful: A Coloring Book for Girls",Hopscotch Girls,2017-11-13,4.8,10594
9,Arts & Photography,Go the F**k to Sleep,Adam Mansbach,2011-06-14,4.8,10125
10,Arts & Photography,Me: Elton John Official Autobiography,Elton John,2019-10-15,4.8,10084
11,Arts & Photography,Strange Planet,Nathan W. Pyle,2019-11-19,4.9,9879
12,Arts & Photography,Fucking Adorable - Cute Critters with foul Mouths,Heather Land,2016-09-05,4.7,9837
13,Arts & Photography,"Secret Garden: An Inky Treasure Hunt and Coloring Book (For Adults, mindfulness coloring)",Johanna Basford,2013-03-26,4.7,9638
14,Arts & Photography,"Adult Coloring Book : Stress Relieving Designs Animals, Mandalas, Flowers, Paisley Patterns And So Much More: Coloring Book For Adults",Cindy Elsharouni,2017-11-17,4.6,9372
15,Arts & Photography,A Street Cat Named Bob: And How He Saved My Life,James Bowen,2013-07-30,4.8,8953
16,Biographies & Memoirs,Becoming,Michelle Obama,2018-11-13,4.8,65052
17,Biographies & Memoirs,Too Much and Never Enough: How My Family Created the World's Most Dangerous Man,Mary L. Trump Ph.D.,2020-07-14,4.6,59436
18,Biographies & Memoirs,Educated: A Memoir,Tara Westover,2018-02-20,4.7,30801
19,Biographies & Memoirs,The Room Where It Happened: A White House Memoir,John Bolton,2020-06-23,4.3,30265
20,Biographies & Memoirs,"Unbroken: A World War II Story of Survival, Resilience, and Redemption",Laura Hillenbrand,2010-11-16,4.8,29784
21,Biographies & Memoirs,The Autobiography of Malcolm X: As Told to Alex Haley,Alex Haley,1987-10-12,4.8,28803
22,Biographies & Memoirs,The 5 Love Languages: The Secret to Love that Lasts,Gary Chapman,2015-01-01,4.8,27397
23,Biographies & Memoirs,Born a Crime: Stories from a South African Childhood,Trevor Noah,2019-02-12,4.8,20444
24,Biographies & Memoirs,Born a Crime: Stories from a South African Childhood,Trevor Noah,2016-11-15,4.8,20444
25,Biographies & Memoirs,Untamed,Glennon Doyle,2020-03-10,4.7,18034
26,Biographies & Memoirs,Can't Hurt Me: Master Your Mind and Defy the Odds,David Goggins,2018-12-10,4.8,17825
27,Biographies & Memoirs,Man's Search for Meaning,Viktor E. Frankl,2006-06-01,4.7,17396
28,Biographies & Memoirs,Man's Search for Meaning,Viktor E. Frankl,1702-01-01,4.7,17396
29,Biographies & Memoirs,Wild: From Lost to Found on the Pacific Crest Trail,Cheryl Strayed,2013-03-26,4.4,17310
30,Biographies & Memoirs,"If You Tell: A True Story of Murder, Family Secrets, and the Unbreakable Bond of Sisterhood",Gregg Olsen,2019-12-01,4.4,16113
31,Biographies & Memoirs,American Sniper: The Autobiography of the Most Lethal Sniper in U.S. Military History,Chris Kyle,2013-01-29,4.6,16087
32,Business & Money,Rich Dad Poor Dad: What the Rich Teach Their Kids About Money That the Poor and Middle Class Do Not!,Robert T. Kiyosaki,2017-04-11,4.7,33298
33,Business & Money,Think and Grow Rich: The Landmark Bestseller Now Revised and Updated for the 21st Century (Think and Grow Rich Series),Napoleon Hill,2005-08-18,4.7,27800
34,Business & Money,How To Win Friends and Influence People,Dale Carnegie,2009-11-03,4.7,26395
35,Business & Money,The Four Agreements (Illustrated Edition): A Practical Guide to Personal Freedom (Four-color Illustrated Ed.),Don Miguel Ruiz,2011-11-15,4.7,25578
36,Business & Money,The Life-Changing Magic of Tidying Up: The Japanese Art of Decluttering and Organizing,Marie Kondo,2014-10-14,4.5,23167
37,Business & Money,12 Rules for Life: An Antidote to Chaos,Jordan B. Peterson,2019-05-02,4.7,20251
38,Business & Money,The Art of War: Illustrated Edition,Sun Tzu,2014-09-02,4.4,14084
39,Business & Money,Atomic Habits: An Easy & Proven Way to Build Good Habits & Break Bad Ones,James Clear,2018-10-16,4.8,13888
40,Business & Money,The Total Money Makeover: Classic Edition: A Proven Plan for Financial Fitness,Dave Ramsey,2013-09-17,4.7,12356
41,Business & Money,"Thinking, Fast and Slow",Daniel Kahneman,2013-04-02,4.6,11603
42,Business & Money,The Intelligent Investor: The Definitive Book on Value Investing. A Book of Practical Counsel (Revised Edition),Benjamin Graham,2006-02-21,4.6,11503
43,Business & Money,The Power of Habit: Why We Do What We Do in Life and Business,Charles Duhigg,2014-01-07,4.6,11134
44,Business & Money,Outliers: The Story of Success,Malcolm Gladwell,2011-06-07,4.6,10939
45,Business & Money,The 48 Laws of Power,Robert Greene,2000-09-01,4.7,10447
46,Business & Money,Quiet: The Power of Introverts in a World That Can't Stop Talking,Susan Cain,2013-01-29,4.6,10350
47,Business & Money,The Richest Man in Babylon,George S. Clason,2002-01-01,4.7,9857
48,Calendars,Who Moved My Cheese 2003 Block Calendar: An A-Mazing Way to Deal With Change in Your Work and in Your Life,Spencer Johnson,2002-07-01,4.6,8141
49,Calendars,"The Knot Ultimate Wedding Planner & Organizer [binder edition]: Worksheets, Checklists, Etiquette, Calendars, and Answers to Frequently Asked Questions by Roney, Carley (2013) Ring-bound",Carley Roney,2012-12-02,4.6,4234
50,Calendars,"Katie Daisy 2020 On-the-Go Weekly Planner: 17-Month Calendar with Pocket (Aug 2019 - Dec 2020, 5"" x 7"" closed)",Amber Lotus Publishing,2019-06-19,4.7,3878
51,Calendars,2021 Pooping Pooches White Elephant Gag Gift Calendar,Gag Gifts For Good Causes,2017-08-20,4.8,3201
52,Calendars,Thomas Kinkade Studios: Disney Dreams Collection 2020 Wall Calendar,Thomas Kinkade,2019-05-28,4.9,2951
53,Calendars,"Katie Daisy 2018 - 2019 On-the-Go Weekly Planner: 17-Month Calendar with Pocket (Aug 2018 - Dec 2019, 5 x 7 closed)",Katie Daisy,2018-05-15,4.7,2405
54,Calendars,Vader's Little Princess 2015 Wall Calendar (Star Wars),Jeffrey Brown,2014-07-22,4.8,2093
55,Calendars,"Katie Daisy 2020 - 2021 On-the-Go Weekly Planner: 17-Month Calendar with Pocket (Aug 2020 - Dec 2021, 5"" x 7"" closed): Hello Beauty",Amber Lotus Publishing,2020-04-20,4.8,1941
56,Calendars,Der Lebensfreude Kalender 2020: Das Original als Jubiläumsausgabe: 30 Jahre Lebensfreude-Kalender,Rolf Merkle,2019-07-05,4.6,1659
57,Calendars,The Power of Intention Perpetual Flip Calendar: A Calendar To Use Year After Year,Wayne W. Dyer,2004-01-01,4.7,1554
58,Calendars,Elements 2017 Calendar: A Visual Exploration of Every Known Atom in the Universe,Theodore Gray,2016-07-05,4.8,1543
59,Calendars,2021 Amy Knapp's Big Grid Family Organizer Wall Calendar: August 2020-December 2021,Amy Knapp,2020-05-01,4.8,1498
60,Calendars,2020 Amy Knapp's Big Grid Family Organizer Wall Calendar: August 2019-December 2020,Amy Knapp,2019-05-01,4.8,1498
61,Calendars,2019 Amy Knapp's Big Grid Family Organizer Wall Calendar: August 2018-December 2019,Amy Knapp,2018-05-01,4.8,1498
62,Calendars,2021 National Park Foundation Wall Calendar,National Park Foundation,2020-07-01,4.7,1461
63,Calendars,2020 National Park Foundation Wall Calendar,National Park Foundation,2019-07-01,4.7,1461
64,Children's Books,The Wonky Donkey,Craig Smith,2010-05-01,4.8,32416
65,Children's Books,The Hunger Games (Book 1),Suzanne Collins,2010-07-03,4.7,32405
66,Children's Books,Wonder,R. J. Palacio,2012-02-14,4.8,28803
67,Children's Books,Mockingjay (Hunger Games),Suzanne Collins,2014-02-25,4.5,27079
68,Children's Books,"School Zone - Big Preschool Workbook - Ages 4 and Up, Colors, Shapes, Numbers 1-10, Alphabet, Pre-Writing, Pre-Reading, Phonics, and More (School Zone Big Workbook Series)",School Zone,2018-06-07,4.8,26191
69,Children's Books,The Hobbit,J. R. R. Tolkien,2012-09-18,4.7,25805
70,Children's Books,"My First Learn to Write Workbook: Practice for Kids with Pen Control, Line Tracing, Letters, and More! (Kids coloring activity books)",Crystal Radke,2019-08-27,4.8,25477
71,Children's Books,"Harry Potter and the Cursed Child, Parts One and Two: The Official Playscript of the Original West End Production",J.K. Rowling,2017-07-25,4.7,24609
72,Children's Books,The Book Thief,Markus Zusak,2007-09-11,4.6,23630
73,Children's Books,Catching Fire |Hunger Games|2,Suzanne Collins,2013-06-04,4.7,22913
74,Children's Books,The Ballad of Songbirds and Snakes (A Hunger Games Novel),Suzanne Collins,2020-05-19,4.7,22800
75,Children's Books,The Very Hungry Caterpillar,Eric Carle,1994-03-23,4.9,21323
76,Children's Books,The Very Hungry Caterpillar Giant Board Book and Plush package,Eric Carle,2001-10-01,4.9,21323
77,Children's Books,"Harry Potter and the Chamber of Secrets: The Illustrated Edition (Harry Potter, Book 2)",J.K. Rowling,2016-10-04,4.9,20763
78,Children's Books,Love You Forever,Robert Munsch,1995-09-01,4.9,19881
79,Children's Books,If Animals Kissed Good Night,Ann Whitford Paul,2014-06-03,4.8,18475
80,Christian Books & Bibles,Educated: A Memoir,Tara Westover,2018-02-20,4.7,30801
81,Christian Books & Bibles,The 5 Love Languages: The Secret to Love that Lasts,Gary Chapman,2015-01-01,4.8,27397
82,Christian Books & Bibles,"Girl, Wash Your Face: Stop Believing the Lies About Who You Are So You Can Become Who You Were Meant to Be",Rachel Hollis,2018-02-06,4.6,23092
83,Christian Books & Bibles,Jesus Calling: Enjoying Peace in His Presence (with Scripture References),Sarah Young,2004-10-10,4.9,20106
84,Christian Books & Bibles,The Shack: Where Tragedy Confronts Eternity,William P. Young,2007-07-01,4.6,19884
85,Christian Books & Bibles,The Power of Your Subconscious Mind,Joseph Murphy,2019-11-13,4.6,19565
86,Christian Books & Bibles,Untamed,Glennon Doyle,2020-03-10,4.7,18034
87,Christian Books & Bibles,"ESV Single Column Journaling Bible (TruTone, Chestnut, Leaves Design)",ESV Bibles by Crossway,2014-08-29,4.6,16779
88,Christian Books & Bibles,Heaven is for Real: A Little Boy's Astounding Story of His Trip to Heaven and Back,Todd Burpo,2010-10-31,4.7,15854
89,Christian Books & Bibles,Proof of Heaven: A Neurosurgeon's Journey into the Afterlife,Eben Alexander,2012-10-23,4.3,13695
90,Christian Books & Bibles,The Total Money Makeover: Classic Edition: A Proven Plan for Financial Fitness,Dave Ramsey,2013-09-17,4.7,12356
91,Christian Books & Bibles,"Prayer Journal for Women: 52 Week Scripture, Devotional & Guided Prayer Journal",Shannon Roberts,2019-03-14,4.8,12027
92,Christian Books & Bibles,The Harbinger: The Ancient Mystery that Holds the Secret of America's Future,Jonathan Cahn,2012-01-03,4.6,11510
93,Christian Books & Bibles,Killing Jesus (Bill O'Reilly's Killing Series),Bill O'Reilly,2013-09-24,4.5,11461
94,Christian Books & Bibles,Left to Tell: Discovering God Amidst the Rwandan Holocaust,Immaculee Ilibagiza,2014-04-07,4.9,11160
95,Christian Books & Bibles,A Christmas Carol: With Original Illustrations In Full Color,Charles Dickens,2016-09-12,4.6,10681
96,Comics & Graphic Novels,"The Boy, the Mole, the Fox and the Horse",Charlie Mackesy,2019-10-22,4.8,16003
97,Comics & Graphic Novels,Harry Potter and the Deathly Hallows (Harry Potter Slipcase Edition),J.K. Rowling,2017-07-13,4.8,15312
98,Comics & Graphic Novels,The Art of War,Sun Tzu,2018-05-08,4.4,14084
99,Comics & Graphic Novels,"Fire and Fury: Inside the Trump White House [Paperback] [Jan 17, 2018] Michael Wolff",Michael Wolff,2018-01-01,4.7,13863
100,Comics & Graphic Novels,The Kite Runner - A Novel,Khaled Hosseini,2004-01-01,4.7,12468
101,Comics & Graphic Novels,The Great Gatsby,F. Scott Fitzgerald,2013-04-23,4.4,11978
102,Comics & Graphic Novels,Strange Planet (Strange Planet Series),Nathan W. Pyle,2019-11-19,4.9,9879
103,Comics & Graphic Novels,Strange Planet,Nathan W. Pyle,2019-11-19,4.9,9879
104,Comics & Graphic Novels,The Outsiders,S. E. Hinton,1988-09-01,4.8,9782
105,Comics & Graphic Novels,What If?: Serious Scientific Answers to Absurd Hypothetical Questions,Randall Munroe,2015-09-24,4.7,9668
106,Comics & Graphic Novels,Alice's Adventures in Wonderland (Dover Thrift Editions),Lewis Carroll,1993-05-20,4.5,8225
107,Comics & Graphic Novels,Twisted Twenty-Six,Janet Evanovich,2019-11-14,4.7,6336
108,Comics & Graphic Novels,Dog Man 5: Lord of the Fleas PB,Dav Pilkey,2019-07-04,4.9,5875
109,Comics & Graphic Novels,The Adventures of Dog Man 2: Unleashed,Dav Pilkey,2018-01-04,4.9,5631
110,Comics & Graphic Novels,The Legend of Zelda: Hyrule Historia,"Patrick Thorpe, Michael Gombos, et al",2013-01-29,4.9,5533
111,Comics & Graphic Novels,How to Tell If Your Cat Is Plotting to Kill You (Volume 2) (The Oatmeal),The Oatmeal,2012-10-09,4.4,5494
112,Computers & Technology,Think and Grow Rich,Napoleon Hill,2012-01-01,4.7,27800
113,Computers & Technology,The Four Agreements (Illustrated Edition): A Practical Guide to Personal Freedom (Four-color Illustrated Ed.),Don Miguel Ruiz,2011-11-15,4.7,25578
114,Computers & Technology,Pride and Prejudice,Jane Austen,1980-01-01,4.5,12930
115,Computers & Technology,Modern Classics the Great Gatsby (Penguin F. Scott Fitzgerald Hardback Collection),F. Scott Fitzgerald,2010-11-16,4.4,11978
116,Computers & Technology,What If?: Serious Scientific Answers to Absurd Hypothetical Questions,Randall Munroe,2015-09-24,4.7,9668
117,Computers & Technology,Start with Why: How Great Leaders Inspire Everyone to Take Action,Simon Sinek,2011-12-27,4.6,9111
118,Computers & Technology,The Personal Internet Address & Password Logbook (removable cover band for security),Peter Pauper Press,2010-06-01,4.6,8709
119,Computers & Technology,Steve Jobs,Walter Isaacson,2011-10-24,4.6,7939
120,Computers & Technology,Animal Crossing: New Horizons Official Companion Guide,Future Press,2020-05-08,4.8,7565
121,Computers & Technology,The Legend of Zelda: Hyrule Historia,"Patrick Thorpe, Michael Gombos, et al",2013-01-29,4.9,5533
122,Computers & Technology,Romeo and Juliet,William Shakespeare,2005-04-08,4.6,4932
123,Computers & Technology,"The Phoenix Project: A Novel about IT, DevOps, and Helping Your Business Win",Gene Kim,2018-02-27,4.7,4929
124,Computers & Technology,Stunning Digital Photography,Tony Northrup,2019-12-01,4.7,4744
125,Computers & Technology,Howl's Moving Castle,Diana Wynne Jones,2008-04-22,4.8,3752
126,Computers & Technology,The Liberal Media Industrial Complex,Mark Dice,2019-11-09,4.9,3654
127,Computers & Technology,The True Story of Fake News: How Mainstream Media Manipulates Millions,Mark Dice,2017-11-01,4.9,3526
128,"Cookbooks, Food & Wine",10-Day Green Smoothie Cleanse: Lose Up to 15 Pounds in 10 Days!,J.J. Smith,2015-01-05,4.7,18223
129,"Cookbooks, Food & Wine","The Secret (Unabridged, 4-CD Set)",Rhonda Byrne,2006-11-28,4.5,17403
130,"Cookbooks, Food & Wine","Pinch of Nom: 100 Slimming, Home-style Recipes",Kay Featherstone,2019-03-21,4.8,17346
131,"Cookbooks, Food & Wine",The Complete Ketogenic Diet for Beginners: Your Essential Guide to Living the Keto Lifestyle,Amy Ramos,2016-12-20,4.3,14124
132,"Cookbooks, Food & Wine",Thug Kitchen: The Official Cookbook: Eat Like You Give a F*ck (Thug Kitchen Cookbooks),Thug Kitchen,2014-10-07,4.6,11515
133,"Cookbooks, Food & Wine",Magnolia Table: A Collection of Recipes for Gathering,Joanna Gaines,2018-04-24,4.8,10761
134,"Cookbooks, Food & Wine","Magnolia Table, Volume 2: A Collection of Recipes for Gathering",Joanna Gaines,2020-04-07,4.9,9353
135,"Cookbooks, Food & Wine",5 Ingredients: Quick & Easy Food,Jamie Oliver,2019-01-08,4.7,8604
136,"Cookbooks, Food & Wine","Salt, Fat, Acid, Heat: Mastering the Elements of Good Cooking",Samin Nosrat,2017-04-25,4.8,8306
137,"Cookbooks, Food & Wine",The Whole30: The 30-Day Guide to Total Health and Food Freedom,Melissa Hartwig Urban,2015-04-21,4.6,7940
138,"Cookbooks, Food & Wine",Instant Pot Pressure Cooker Cookbook: 500 Everyday Recipes for Beginners and Advanced Users. Try Easy and Healthy Instant Pot Recipes.,Jennifer Smith,2018-09-20,4.4,7773
139,"Cookbooks, Food & Wine",The Instant Pot Electric Pressure Cooker Cookbook: Easy Recipes for Fast & Healthy Meals,Laurel Randolph,2016-04-06,4.3,7677
140,"Cookbooks, Food & Wine","Wheat Belly: Lose the Wheat, Lose the Weight, and Find Your Path Back to Health",William Davis,2014-06-03,4.4,7570
141,"Cookbooks, Food & Wine","The Plant Paradox: The Hidden Dangers in ""Healthy"" Foods That Cause Disease and Weight Gain",Dr. Steven R Gundry MD,2017-07-11,4.4,7451
142,"Cookbooks, Food & Wine",Forks Over Knives―The Cookbook: Over 300 Recipes for Plant-Based Eating All Through the Year,Del Sroufe,2012-08-14,4.5,6903
143,"Cookbooks, Food & Wine","The Ultimate Instant Pot cookbook: Foolproof, Quick & Easy 800 Instant Pot Recipes for Beginners and Advanced Users (Pressure Cooker Recipes)",Simon Rush,2019-10-12,4.7,6245
144,"Crafts, Hobbies & Home",Outlander,Diana Gabaldon,1992-06-02,4.7,27780
145,"Crafts, Hobbies & Home",The Life-Changing Magic of Tidying Up: The Japanese Art of Decluttering and Organizing,Marie Kondo,2014-10-14,4.5,23167
146,"Crafts, Hobbies & Home",Pinch of Nom: 100 Home-Style Recipes for Health and Weight Loss,Kay Featherstone,2020-04-28,4.8,17346
147,"Crafts, Hobbies & Home",The Art of War (Chiltern Classic),Sun Tzu,2018-09-27,4.4,14084
148,"Crafts, Hobbies & Home",Pride and Prejudice (Chiltern Classic),Jane Austen,2018-09-27,4.5,12930
149,"Crafts, Hobbies & Home",The Great Gatsby (Chiltern Classic),F. Scott Fitzgerald Fitzgerald,2018-09-27,4.4,11978
150,"Crafts, Hobbies & Home",Calm the F*ck Down: An Irreverent Adult Coloring Book (Irreverent Book Series),Sasha O'Hara,2016-01-06,4.6,11160
151,"Crafts, Hobbies & Home",Wuthering Heights (Chiltern Classic),Emily Bronte,2018-09-27,4.4,11031
152,"Crafts, Hobbies & Home",A Christmas Carol (Chiltern Classic),Charles Dickens,2020-09-08,4.6,10681
153,"Crafts, Hobbies & Home","I Am Confident, Brave & Beautiful: A Coloring Book for Girls",Hopscotch Girls,2017-11-13,4.8,10594
154,"Crafts, Hobbies & Home",How Not to Die: Discover the Foods Scientifically Proven to Prevent and Reverse Disease,Michael Greger M.D. FACLM,2015-12-08,4.7,10272
155,"Crafts, Hobbies & Home",Zen as F*ck (Zen as F*ck Journals),Monica Sweeney,2018-03-06,4.7,9857
156,"Crafts, Hobbies & Home",Wacky Waving Inflatable Tube Guy (RP Minis),Conor Riordan,2018-10-02,4.7,9845
157,"Crafts, Hobbies & Home",Fucking Adorable - Cute Critters with foul Mouths,Heather Land,2016-09-05,4.7,9837
158,"Crafts, Hobbies & Home","Secret Garden: An Inky Treasure Hunt and Coloring Book (For Adults, mindfulness coloring)",Johanna Basford,2013-03-26,4.7,9638
159,"Crafts, Hobbies & Home",Jane Eyre (Chiltern Classic),Charlotte Brontë,2018-09-27,4.6,9635
160,Education & Teaching,"My First Learn to Write Workbook: Practice for Kids with Pen Control, Line Tracing, Letters, and More! (Kids coloring activity books)",Crystal Radke,2019-08-27,4.8,25477
161,Education & Teaching,The Art of War,Sun Tzu,1983-03-10,4.4,14084
162,Education & Teaching,The Total Money Makeover: Classic Edition: A Proven Plan for Financial Fitness,Dave Ramsey,2013-09-17,4.7,12356
163,Education & Teaching,A CHRISTMAS CAROL (PACEMAKER CLASSICS),Charles Dickens,1950-01-01,4.6,10681
164,Education & Teaching,NLLB: ANIMAL FARM (Pearson English Graded Readers),George Orwell,2016-01-01,4.7,10344
165,Education & Teaching,First Little Readers Parent Pack: Guided Reading Level A: 25 Irresistible Books That Are Just the Right Level for Beginning Readers,Deborah Schecter,2010-10-01,4.7,8141
166,Education & Teaching,"Tuesdays with Morrie: An Old Man, A Young Man and Life's Greatest Lesson",Mitch Albom,1997-08-18,4.8,7887
167,Education & Teaching,"ATI TEAS Secrets Study Guide: TEAS 6 Complete Study Manual, Full-Length Practice Tests, Review Video Tutorials for the Test of Essential Academic Skills, Sixth Edition",TEAS Exam Secrets Test Prep Team,2016-03-31,4.7,7882
168,Education & Teaching,Holes (Rigorous Reading),Louis Sachar,2016-03-01,4.8,6974
169,Education & Teaching,"Preschool Math Workbook for Toddlers Ages 2-4: Beginner Math Preschool Learning Book with Number Tracing and Matching Activities for 2, 3 and 4 year olds and kindergarten prep",Modern Kid Press,2019-10-29,4.7,6663
170,Education & Teaching,"My First Toddler Coloring Book: Fun with Numbers, Letters, Shapes, Colors, and Animals! (Kids coloring activity books)",Tanya Emelyanova,2018-02-06,4.8,6604
171,Education & Teaching,Teach Your Child to Read in 100 Easy Lessons,Siegfried Engelmann,1986-06-15,4.5,6401
172,Education & Teaching,"School Zone - Sight Words Flash Cards - Ages 5 and Up, Kindergarten to 1st Grade, Phonics, Beginning Reading, Sight Reading, Early-Reading Words, and More",School Zone,2015-05-05,4.8,6346
173,Education & Teaching,As A Man Thinketh,James Allen,2019-03-13,4.7,6301
174,Education & Teaching,"Learn to Read: A Magical Sight Words and Phonics Activity Workbook for Beginning Readers Ages 5-7: Reading Made Easy | Preschool, Kindergarten and 1st Grade",Modern Kid Press,2019-04-16,4.7,5980
175,Education & Teaching,Sapiens: Uma Breve Historia da Humanidade (Em Portugues do Brasil), Yuval Noah Harari and Janaína Marcoantonio,2015-01-01,4.8,5897
176,Engineering & Transportation,Art of War (Chump Change Edition),Sun Tzu,2017-04-01,4.4,14084
177,Engineering & Transportation,The Help,Kathryn Stockett,2011-04-05,4.8,14053
178,Engineering & Transportation,Wacky Waving Inflatable Tube Guy (RP Minis),Conor Riordan,2018-10-02,4.7,9845
179,Engineering & Transportation,"Elon Musk: Tesla, SpaceX, and the Quest for a Fantastic Future",Ashlee Vance,2017-01-24,4.7,8176
180,Engineering & Transportation,No Easy Day: The Only First-hand Account of the Navy Seal Mission that Killed Osama bin Laden,Mark Owen,2013-06-06,4.6,8168
181,Engineering & Transportation,Steve Jobs,Walter Isaacson,2011-10-24,4.6,7939
182,Engineering & Transportation,Dead Wake: The Last Crossing of the Lusitania,Erik Larson,2016-03-22,4.5,7643
183,Engineering & Transportation,Bad Blood: Secrets and Lies in a Silicon Valley Startup,John Carreyrou,2020-01-28,4.8,6509
184,Engineering & Transportation,The Wright Brothers,David McCullough,2016-05-03,4.7,6216
185,Engineering & Transportation,"Guns, Germs, and Steel: The Fates of Human Societies","Jared Diamond, Doug Ordunio, et al.",2017-03-07,4.5,4498
186,Engineering & Transportation,The Radium Girls: The Dark Story of America’s Shining Women,Kate Moore,2018-03-06,4.7,4289
187,Engineering & Transportation,"The Elements of Style, Fourth Edition",William Strunk Jr.,2019-05-25,4.7,4190
188,Engineering & Transportation,The Elements of Style (4th Edition),William Strunk,1999-08-24,4.7,4190
189,Engineering & Transportation,Endurance: Shackleton's Incredible Voyage,Alfred Lansing,2015-04-28,4.8,4058
190,Engineering & Transportation,The Bluest Eye,Toni Morrison,1993-12-28,4.7,3856
191,Engineering & Transportation,Hidden Figures: The American Dream and the Untold Story of the Black Women Mathematicians Who Helped Win the Space Race,Margot Lee Shetterly,2016-12-06,4.5,3723
192,"Health, Fitness & Dieting",The Subtle Art of Not Giving a F*ck: A Counterintuitive Approach to Living a Good Life,Mark Manson,2016-09-13,4.6,28174
193,"Health, Fitness & Dieting",Think and Grow Rich,Napoleon Hill,1987-05-12,4.7,27800
194,"Health, Fitness & Dieting",The 5 Love Languages: The Secret to Love That Lasts,Gary Chapman,2010-10-01,4.8,27397
195,"Health, Fitness & Dieting",How to Win Friends & Influence People,Dale Carnegie,1990-02-15,4.7,26395
196,"Health, Fitness & Dieting",The Four Agreements: A Practical Guide to Personal Freedom (A Toltec Wisdom Book),Don Miguel Ruiz,1997-11-07,4.7,25578
197,"Health, Fitness & Dieting",Life Changing Magic Of Tidying,Marie Kondo,2014-04-03,4.5,23167
198,"Health, Fitness & Dieting",12 Rules for Life: An Antidote to Chaos,Jordan B. Peterson,2018-01-23,4.7,20251
199,"Health, Fitness & Dieting",The Power of Your Subconscious Mind,Joseph Murphy,2008-11-24,4.6,19565
200,"Health, Fitness & Dieting",10-Day Green Smoothie Cleanse,JJ Smith,2014-07-15,4.7,18223
201,"Health, Fitness & Dieting",Player's Handbook (Dungeons & Dragons),Wizards RPG Team,2014-08-19,4.8,18133
202,"Health, Fitness & Dieting",Untamed,Glennon Doyle,2020-03-10,4.7,18034
203,"Health, Fitness & Dieting",Can't Hurt Me: Master Your Mind and Defy the Odds,David Goggins,2018-12-04,4.8,17825
204,"Health, Fitness & Dieting",The Secret,Rhonda Byrne,2006-11-28,4.5,17403
205,"Health, Fitness & Dieting",Man's Search for Meaning,Viktor E. Frankl,2006-06-01,4.7,17396
206,"Health, Fitness & Dieting",Man's Search for Meaning,Viktor E. Frankl,1702-01-01,4.7,17396
207,"Health, Fitness & Dieting","Pinch of Nom: 100 Slimming, Home-style Recipes",Kay Featherstone,2019-03-21,4.8,17346
208,History,Too Much and Never Enough: How My Family Created the World's Most Dangerous Man,Mary L. Trump Ph.D.,2020-07-14,4.6,59436
209,History,The Room Where It Happened: A White House Memoir,John Bolton,2020-06-23,4.3,30265
210,History,"Unbroken: A World War II Story of Survival, Resilience, and Redemption",Laura Hillenbrand,2010-11-16,4.8,29784
211,History,To Kill a Mockingbird,Harper Lee,2005-07-05,4.8,27800
212,History,Sapiens: A Brief History of Humankind,Yuval Noah Harari,2018-05-15,4.6,25563
