,CATEGORY,TITLE,AUTHOR,DATE,STAR,RATING
458,Sports & Outdoors,"Sacred Woman: A Guide to Healing the Feminine Body, Mind, and Spirit",Queen Afua,2001-10-30,4.8,6488
459,Sports & Outdoors,As the Crow Flies (DI Nick Dixon Crime),Damien Boyd,2015-01-20,4.7,6378
460,Sports & Outdoors,A Walk in the Woods: Rediscovering America on the Appalachian Trail,Bill Bryson,2006-12-26,4.5,6184
461,Sports & Outdoors,A Walk in the Woods: Rediscovering America on the Appalachian Trail (Official Guides to the Appalachian Trail),Bill Bryson,1999-05-04,4.5,6184
462,Sports & Outdoors,Into the Wild,Jon Krakauer,1997-01-20,4.5,5428
463,Sports & Outdoors,"4-Hour Body An Uncommon Guide to Rapid Fat-Loss, Incredible Sex and Becoming Superhuman",Timothy Ferriss,2011-01-27,4.3,4678
464,Teen & Young Adult,Gone Girl (Turtleback School & Library Binding Edition),Gillian Flynn,2014-04-22,4.7,57622
465,Teen & Young Adult,The Fault in Our Stars,John Green,2014-04-08,4.7,50876
466,Teen & Young Adult,The Martian: Classroom Edition: A Novel,Andy Weir,2016-05-03,4.7,39758
467,Teen & Young Adult,The Goldfinch: A Novel (Pulitzer Prize for Fiction),Donna Tartt,2015-04-07,4.7,34225
468,Teen & Young Adult,The Alchemist - Gift Edition,Paulo Coelho,2006-04-25,4.7,33490
469,Teen & Young Adult,The Hunger Games (Book 1),Suzanne Collins,2008-10-01,4.7,32405
470,Teen & Young Adult,To Kill a Mockingbird,Harper Lee,2006-05-23,4.8,27800
471,Teen & Young Adult,Midnight Sun,Stephenie Meyer,2020-08-04,4.8,27765
472,Teen & Young Adult,Divergent (Divergent Series),Veronica Roth,2014-09-30,4.6,27295
473,Teen & Young Adult,Mockingjay (Hunger Games),Suzanne Collins,2014-02-25,4.5,27079
474,Teen & Young Adult,J.R.R. Tolkien 4-Book Boxed Set: The Hobbit and The Lord of the Rings,J.R.R. Tolkien,2012-09-25,4.7,25805
475,Teen & Young Adult,The Hobbit,J. R. R. Tolkien,2012-09-18,4.7,25805
476,Teen & Young Adult,The Book Thief,Markus Zusak,2007-09-11,4.6,23630
477,Teen & Young Adult,1984 (Turtleback School & Library Binding Edition) (Signet Classics),George Orwell,1950-07-01,4.7,23312
478,Teen & Young Adult,The Tattooist of Auschwitz: Young Adult edition - including new foreword and Q+A by the author: the heart-breaking and unforgettable international bestseller,Heather Morris,2019-05-23,4.7,23047
479,Teen & Young Adult,"Catching Fire (The Hunger Games, Book 2)",Suzanne Collins,2009-09-01,4.7,22913
480,Test Preparation,"My First Learn to Write Workbook: Practice for Kids with Pen Control, Line Tracing, Letters, and More! (Kids coloring activity books)",Crystal Radke,2019-08-27,4.8,25477
481,Test Preparation,The Art of War,Sun Tzu,2008-12-18,4.4,14084
482,Test Preparation,Pride and Prejudice (Dover Thrift Study Edition),Jane Austen,2009-08-03,4.5,12930
483,Test Preparation,The Total Money Makeover: Classic Edition: A Proven Plan for Financial Fitness,Dave Ramsey,2013-09-17,4.7,12356
484,Test Preparation,Left to Tell: Discovering God Amidst The Rwandan Holocaust,Immaculee Ilibagiza,2006-03-15,4.9,11161
485,Test Preparation,A Christmas Carol,Charles Dickens,1938-01-01,4.6,10681
486,Test Preparation,"ATI TEAS Secrets Study Guide: TEAS 6 Complete Study Manual, Full-Length Practice Tests, Review Video Tutorials for the Test of Essential Academic Skills, Sixth Edition",TEAS Exam Secrets Test Prep Team,2016-03-31,4.7,7882
487,Test Preparation,"School Zone - Sight Words Flash Cards - Ages 5 and Up, Kindergarten to 1st Grade, Phonics, Beginning Reading, Sight Reading, Early-Reading Words, and More",School Zone,2015-05-05,4.8,6346
488,Test Preparation,"Learn to Read: A Magical Sight Words and Phonics Activity Workbook for Beginning Readers Ages 5-7: Reading Made Easy | Preschool, Kindergarten and 1st Grade",Modern Kid Press,2019-04-16,4.7,5980
489,Test Preparation,Sapiens: Uma Breve Historia da Humanidade (Em Portugues do Brasil),Yuval Noah Harari and Janaína Marcoantonio,2015-01-01,4.8,5897
490,Test Preparation,Mindset: The New Psychology of Success,Carol S. Dweck,2007-12-26,4.6,5841
491,Test Preparation,"Number Tracing Book for Preschoolers and Kids Ages 3-5: Trace Numbers Practice Workbook for Pre K, Kindergarten and Kids Ages 3-5 (Math Activity Book)",Modern Kid Press,2018-04-15,4.8,5457
492,Test Preparation,Les Miserables: Complete and Unabridged,Victor Hugo,1996-01-01,4.3,5444
493,Test Preparation,Romeo and Juliet (Dover Thrift Study Edition),William Shakespeare,2009-08-03,4.6,4932
494,Test Preparation,Adventures of Huckleberry Finn (Dover Thrift Study Edition),Mark Twain,2009-08-03,4.5,4800
495,Test Preparation,"Trace Letters Of The Alphabet and Sight Words (On The Go): Preschool Practice Handwriting Workbook: Pre K, Kindergarten and Kids Ages 3-5 Reading And Writing",Modern Kid Press,2018-03-02,4.7,4700
496,Travel,Wild: From Lost to Found on the Pacific Crest Trail,Cheryl Strayed,2013-03-26,4.4,17310
497,Travel,Wuthering Heights (Barnes & Noble Classics),Emily Bronte,2005-08-01,4.4,11031
498,Travel,Rand McNally 2021 Large Scale Road Atlas (Rand McNally Road Atlas),Rand McNally,2020-04-23,4.8,6676
499,Travel,"Born to Run: A Hidden Tribe, Superathletes, and the Greatest Race the World Has Never Seen",Christopher McDougall,2011-03-29,4.7,6553
500,Travel,Little Women (Leatherbound Classic Collection) by Louisa May Alcott (2012) Leather Bound,Louisa May Alcott,2012-01-01,4.5,6484
501,Travel,A Walk in the Woods: Rediscovering America on the Appalachian Trail,Bill Bryson,2006-12-26,4.5,6184
502,Travel,A Walk in the Woods: Rediscovering America on the Appalachian Trail (Official Guides to the Appalachian Trail),Bill Bryson,1999-05-04,4.5,6184
503,Travel,"Eat, Pray, Love: One Woman's Search for Everything Across Italy, India and Indonesia",Elizabeth Gilbert,2007-01-30,4.3,5860
504,Travel,Into the Wild,Jon Krakauer,1997-01-20,4.5,5428
505,Travel,Cutting for Stone,Abraham Verghese,2010-01-26,4.6,4951
506,Travel,People of Walmart.com Adult Coloring Book: Rolling Back Dignity (OFFICIAL People of Walmart Coloring Books),Day Drankin' Press,2016-09-30,4.7,4945
507,Travel,"50 States, 5,000 Ideas: Where to Go, When to Go, What to See, What to Do",National Geographic,2017-02-07,4.5,4798
508,Travel,Emotional Intelligence 2.0,Travis Bradberry,2010-05-15,4.4,4600
509,Travel,Into Thin Air: A Personal Account of the Mount Everest Disaster,Jon Krakauer,1997-04-22,4.7,4580
510,Travel,In Cold Blood (Modern Library 100 Best Nonfiction Books),Truman Capote,2002-03-05,4.6,4087
511,Travel,Endurance: Shackleton's Incredible Voyage,Alfred Lansing,2015-04-28,4.8,4058
512,Arts & Photography,Alice's Adventures in Wonderland: 150th Anniversary Edition,Lewis Carroll,2015-09-29,4.5,8239
513,Arts & Photography,First Little Readers Parent Pack: Guided Reading Level A: 25 Irresistible Books That Are Just the Right Level for Beginning Readers,Deborah Schecter,2010-10-01,4.7,8158
514,Arts & Photography,Lettering and Modern Calligraphy: A Beginner's Guide: Learn Hand Lettering and Brush Lettering,Paper Peony Press,2017-10-27,4.4,8141
515,Arts & Photography,Disney Dreams Collection Thomas Kinkade Studios Coloring Book,Thomas Kinkade,2017-09-19,4.7,7989
516,Arts & Photography,Hinch Yourself Happy: All The Best Cleaning Tips To Shine Your Sink And Soothe Your Soul,Mrs Hinch,2019-04-04,4.7,7723
517,Arts & Photography,Mrs Hinch: The Activity Journal,Mrs Hinch,2019-10-17,4.8,6930
518,Arts & Photography,Dracula,Bram Stoker,2012-04-10,4.5,6816
519,Arts & Photography,"The Ultimate Guide to Modern Calligraphy & Hand Lettering for Beginners: Learn to Letter: A Hand Lettering Workbook with Tips, Techniques, Practice Pages, and Projects",June & Lucy,2019-08-12,4.6,6482
520,Arts & Photography,Hamilton: The Revolution,Lin-Manuel Miranda,2016-04-12,4.9,6315
521,Arts & Photography,Adult Coloring Book: Stress Relieving Animal Designs,MantraCraft,2018-01-26,4.6,6190
522,Arts & Photography,Bossypants,Tina Fey,2012-01-03,4.3,6060
523,Arts & Photography,A Swear Word Coloring Book for Adults: Sweary AF: F*ckity F*ck F*ck F*ck,Honey Badger Coloring,2017-09-18,4.7,6016
524,Arts & Photography,"100 Amazing Patterns: An Adult Coloring Book with Fun, Easy, and Relaxing Coloring Pages",Jade Summer,2019-07-15,4.6,5700
525,Arts & Photography,Let That Sh*t Go: A Journal for Leaving Your Bullsh*t Behind and Creating a Happy Life: Zen as F*ck Journals,Publish Book,2019-12-23,4.7,5663
526,Arts & Photography,"Enchanted Forest: An Inky Quest and Coloring book (Activity Books, Mindfulness and Meditation, Illustrated Floral Prints)",Johanna Basford,2015-02-17,4.8,5560
527,Arts & Photography,The Legend of Zelda: Hyrule Historia,"Patrick Thorpe, Michael Gombos, et al.",2013-01-29,4.9,5535
528,Biographies & Memoirs,This Is Going to Hurt: Secret Diaries of a Medical Resident,Adam Kay,2019-12-03,4.6,15990
529,Biographies & Memoirs,Heaven is for Real: A Little Boy's Astounding Story of His Trip to Heaven and Back,Todd Burpo,2010-10-31,4.7,15856
530,Biographies & Memoirs,Hillbilly Elegy: A Memoir of a Family and Culture in Crisis,J. D. Vance,2018-05-01,4.4,15841
531,Biographies & Memoirs,Maude,Donna Foley Mabry,2014-10-16,4.4,14607
532,Biographies & Memoirs,When Breath Becomes Air,Paul Kalanithi,2016-01-12,4.8,14217
533,Biographies & Memoirs,The Art Of War,Sun Tzu,2007-11-01,4.4,14107
534,Biographies & Memoirs,Fire and Fury: Inside the Trump White House,Michael Wolff,2019-01-08,4.7,13868
535,Biographies & Memoirs,Lone Survivor: The Eyewitness Account of Operation Redwing and the Lost Heroes of SEAL Team 10,Marcus Luttrell,2008-05-01,4.8,13826
536,Biographies & Memoirs,Proof of Heaven: A Neurosurgeon's Journey into the Afterlife,Eben Alexander,2012-10-23,4.3,13700
537,Biographies & Memoirs,12 Years a Slave,Solomon Northup,2014-02-21,4.6,12545
538,Biographies & Memoirs,Just Mercy: A Story of Justice and Redemption,Bryan Stevenson,2015-08-18,4.8,11928
539,Biographies & Memoirs,How to Be an Antiracist,Ibram X. Kendi,2019-08-13,4.8,11890
540,Biographies & Memoirs,Sharp Objects,Gillian Flynn,2007-07-31,4.3,11637
541,Biographies & Memoirs,Killing Patton: The Strange Death of World War II's Most Audacious General (Bill O'Reilly's Killing Series),Bill O'Reilly,2014-09-23,4.6,10973
542,Biographies & Memoirs,Between the World and Me,Ta-Nehisi Coates,2015-07-14,4.7,10919
543,Biographies & Memoirs,The 48 Laws of Power,Robert Greene,2000-09-01,4.7,10457
544,Business & Money,The 7 Habits of Highly Effective People: 30th Anniversary Card Deck (The Official 7 Habits Card Deck),Stephen R. Covey,2019-07-02,4.6,9656
545,Business & Money,Extreme Ownership: How U.S. Navy SEALs Lead and Win (New Edition),Jocko Willink,2017-11-21,4.8,9501
546,Business & Money,Start with Why: How Great Leaders Inspire Everyone to Take Action,Simon Sinek,2011-12-27,4.6,9127
547,Business & Money,"The 4-Hour Workweek: Escape 9-5, Live Anywhere, and Join the New Rich",Timothy Ferriss,2009-12-15,4.5,8930
548,Business & Money,Shoe Dog: A Memoir by the Creator of Nike,Phil Knight,2018-05-01,4.8,8737
549,Business & Money,Meditations: A New Translation (Modern Library (Hardcover)),Marcus Aurelius,2002-05-14,4.6,8319
550,Business & Money,"Elon Musk: Tesla, SpaceX, and the Quest for a Fantastic Future",Ashlee Vance,2017-01-24,4.7,8189
551,Business & Money,Who Moved My Cheese?: An A-Mazing Way to Deal with Change in Your Work and in Your Life,Spencer Johnson,1999-01-01,4.6,8155
552,Business & Money,Who Moved My Cheese,Spencer Johnson,1998-09-08,4.6,8155
553,Business & Money,"Girl, Stop Apologizing: A Shame-Free Plan for Embracing and Achieving Your Goals",Rachel Hollis,2019-03-05,4.6,8121
554,Business & Money,Steve Jobs,Walter Isaacson,2011-10-24,4.6,7944
555,Business & Money,Hinch Yourself Happy: All The Best Cleaning Tips To Shine Your Sink And Soothe Your Soul,Mrs Hinch,2019-04-04,4.7,7723
556,Business & Money,Mrs Hinch: The Activity Journal,Mrs Hinch,2019-10-17,4.8,6930
557,Business & Money,Bad Blood: Secrets and Lies in a Silicon Valley Startup,John Carreyrou,2020-01-28,4.8,6527
558,Business & Money,Little Women (Great Illustrated Classics),Louisa May Alcott,2008-01-01,4.5,6493
559,Business & Money,Talking to Strangers: What We Should Know about the People We Don’t Know,Malcolm Gladwell,2019-09-10,4.5,6441
560,Calendars,2019 National Park Foundation Wall Calendar,National Park Foundation,2018-07-01,4.7,1461
561,Calendars,Pusheen 2020 Wall Calendar,Claire Belton,2019-06-18,4.9,1459
562,Calendars,Dilbert 2020 Day-to-Day Calendar,Scott Adams,2019-05-21,4.9,1420
563,Calendars,FORTNITE (Official): 2020 Calendar,Epic Games,2019-07-30,4.8,1368
564,Calendars,Thomas Kinkade Painter of Light 2020 Deluxe Wall Calendar,Thomas Kinkade,2019-06-18,4.9,1145
565,Calendars,F*cking Planner Stickers: Over 500 f*cking stickers to get your sh*t under control,Sourcebooks,2019-08-01,4.7,1078
566,Calendars,Mary Engelbreit 2020 Deluxe Wall Calendar: A Woman of Few Words,Mary Engelbreit,2019-05-28,4.9,1025
567,Calendars,Doug the Pug 2020 Wall Calendar (Dog Breed Calendar),Leslie Mosier,2019-06-28,4.9,1011
568,Calendars,Mom's Family Wall Calendar 2020,Sandra Boynton,2019-07-09,4.8,994
569,Calendars,Dog Shaming 2020 Day-to-Day Calendar,Pascale Lemire,2019-07-02,4.8,945
570,Calendars,A F*cking 2021 Calendar: Get Your Sh*t Together This Year - Includes Stickers!,Sourcebooks,2020-05-01,4.9,943
571,Calendars,A F*cking 2020 Calendar: Get Your Sh*t Together This Year- Includes Stickers!,Sourcebooks,2019-05-01,4.9,943
572,Calendars,Wer weiß denn sowas? Tagesabreißkalender 2020,NO AUTHOR,2019-04-16,4.7,942
573,Calendars,Under the Tuscan Sun 2011 Engagement Calendar,Frances Mayes,2010-07-28,4.7,933
574,Calendars,"Llewellyn's 2020 Astrological Calendar: 87th Edition of the World's Best Known, Most Trusted Astrology Calendar",Bruce Scofield,2019-07-08,4.7,895
575,Calendars,2021 Amy Knapp's The Very Busy Planner: August 2020-December 2021,Amy Knapp,2020-05-12,4.6,887
576,Children's Books,"Carson Dellosa | First Words Flash Cards | Phonics, Preschool, 54ct",Brighter Child,2006-03-15,4.8,17804
577,Children's Books,Man's Search for Meaning: Young Adult Edition,Viktor E. Frankl,2017-04-25,4.7,17445
578,Children's Books,The Hunger Games Trilogy: The Hunger Games / Catching Fire / Mockingjay,Suzanne Collins,2014-06-24,4.8,17376
579,Children's Books,The Hobbit (or There and Back Again),J.R.R. Tolkien,1973-10-24,4.7,16830
580,Children's Books,"Brown Bear, Brown Bear, What Do You See?", Bill Martin Jr. and Eric Carle,1996-09-15,4.9,15598
581,Children's Books,Harry Potter and the Deathly Hallows (Book 7),J. K. Rowling,2009-07-07,4.8,15334
582,Children's Books,Harry Potter and the Deathly Hallows (Book 7),J. K. Rowling,2007-07-21,4.8,15334
583,Children's Books,Harry Potter And The Order Of The Phoenix,J.K. Rowling,2004-08-10,4.8,15231
584,Children's Books,Giraffes Can't Dance,Giles Andreae,2012-03-01,4.8,15175
585,Children's Books,"Oh, the Places You'll Go!  ",Dr. Seuss,1990-01-22,4.9,14422
586,Children's Books,Harry Potter And The Prisoner Of Azkaban,J.K. Rowling,2001-09-11,4.9,14248
587,Children's Books,Harry Potter And The Goblet Of Fire,J.K. Rowling,2002-07-30,4.9,14144
588,Children's Books,Harry Potter Paperback Box Set (Books 1-7),J. K. Rowling,2009-07-01,4.8,14106
589,Children's Books,Harry Potter and the Half-Blood Prince (Book 6),J.K. Rowling,2006-07-25,4.9,13501
590,Children's Books,Dog Man: Fetch-22: From the Creator of Captain Underpants (Dog Man #8),Dav Pilkey,2019-12-10,4.9,13413
591,Christian Books & Bibles,"Relationship Goals: How to Win at Dating, Marriage, and Sex",Michael Todd,2020-04-28,4.9,9697
592,Christian Books & Bibles,The Day The Crayons Quit,Drew Daywalt,2016-02-25,4.8,9313
593,Christian Books & Bibles,"Good Omens: The Nice and Accurate Prophecies of Agnes Nutter, Witch",Neil Gaiman,2019-03-05,4.7,8724
594,Christian Books & Bibles,Meditations (Everyman's Library Classics Series),Marcus Aurelius,1992-06-02,4.6,8319
595,Christian Books & Bibles,"Boundaries Updated and Expanded Edition: When to Say Yes, How to Say No To Take Control of Your Life",Henry Cloud,2017-10-03,4.7,8120
596,Christian Books & Bibles,The Magnolia Story,Chip Gaines,2016-10-18,4.8,8035
597,Christian Books & Bibles,It's Not Supposed to Be This Way: Finding Unexpected Strength When Disappointments Leave You Shattered,Lysa TerKeurst,2018-11-13,4.8,7778
598,Christian Books & Bibles,When God Made You,Matthew Paul Turner,2017-02-28,4.9,7684
599,Christian Books & Bibles,Battlefield of the Mind: Winning the Battle in Your Mind,Joyce Meyer,2002-10-01,4.8,7680
600,Christian Books & Bibles,Redeeming Love,Francine Rivers,2005-05-09,4.8,7677
601,Christian Books & Bibles,The Da Vinci Code: A Novel (Robert Langdon),Dan Brown,2010-10-19,4.6,7676
602,Christian Books & Bibles,God Gave Us You,Lisa Tawn Bergren,2000-09-19,4.9,7402
603,Christian Books & Bibles,Get Out of Your Head: Stopping the Spiral of Toxic Thoughts,Jennie Allen,2020-01-28,4.7,6672
604,Christian Books & Bibles,The Action Bible,Sergio Cariello,2010-09-01,4.9,6550
605,Christian Books & Bibles,"Sacred Woman: A Guide to Healing the Feminine Body, Mind, and Spirit",Queen Afua,2001-10-30,4.8,6498
606,Christian Books & Bibles,Little Women,Louisa May Alcott,2017-02-07,4.5,6493
607,Comics & Graphic Novels,Frankenstein (Everyman's Library),Mary Shelley,1992-03-10,4.5,5460
608,Comics & Graphic Novels,Stoner Coloring Book for Adults: The Stoner's Psychedelic Coloring Book,Edwina Mc Namee,2019-06-23,4.7,5416
609,Comics & Graphic Novels,Anne of Green Gables (Illustrated Classics),L. M. Montgomery,2017-09-26,4.6,5129
610,Comics & Graphic Novels,"Hyperbole and a Half: Unfortunate Situations, Flawed Coping Mechanisms, Mayhem, and Other Things That Happened",Allie Brosh,2013-10-29,4.7,5048
611,Comics & Graphic Novels,Moby Dick (Classics Illustrated),Herman Melville,2015-09-01,4.4,4964
612,Comics & Graphic Novels,The Hitchhiker Trilogy (5 Books),Douglas Adams,2004-01-01,4.7,4959
613,Comics & Graphic Novels,The Complete Calvin and Hobbes,Bill Watterson,2012-11-13,4.9,4944
614,Comics & Graphic Novels,Romeo and Juliet,William Shakespeare,2005-04-08,4.6,4940
615,Comics & Graphic Novels,Adventures of Huckleberry Finn: Tom Sawyer's Companion,Mark Twain,1994-01-01,4.5,4805
616,Comics & Graphic Novels,The Hitchhiker's Guide to the Galaxy,Douglas Adams,1995-09-27,4.5,4702
617,Comics & Graphic Novels,NOS4A2,Joe Hill,2019-05-16,4.5,4692
618,Comics & Graphic Novels,Batman: The Killing Joke Deluxe (New Edition),Alan Moore,2019-09-17,4.8,4604
619,Comics & Graphic Novels,The Secret Garden (Illustrated Classics),Frances Hodgson Burnett,2017-09-05,4.6,4551
620,Comics & Graphic Novels,Treasure Island (Dover Thrift Editions),Robert Louis Stevenson,1993-04-19,4.5,4431
621,Comics & Graphic Novels,Coraline,Neil Gaiman,2008-10-28,4.8,4275
622,Comics & Graphic Novels,The Walking Dead: Compendium One,Robert Kirkman,2009-05-19,4.8,4198
623,Computers & Technology,The Legend of Zelda: Breath of the Wild The Complete Official Guide: -Expanded Edition,Piggyback,2018-02-13,4.8,3476
624,Computers & Technology,"Los cuatro acuerdos: The Four Agreements, Spanish-Language Edition (Toltec Wisdom) (Spanish Edition)",Don Miguel Ruiz,2005-03-10,4.8,3363
625,Computers & Technology,Shit I Can't Remember,Christelle Ball,2017-03-04,4.5,3249
626,Computers & Technology,Cracking the Coding Interview: 189 Programming Questions and Solutions,Gayle Laakmann McDowell,2015-07-01,4.6,3019
627,Computers & Technology,The Everything Store: Jeff Bezos and the Age of Amazon,Brad Stone,2013-10-15,4.6,2820
628,Computers & Technology,The Elder Scrolls: The Official Cookbook,Chelsea Monroe-Cassel,2019-03-26,4.9,2793
629,Computers & Technology,The Black Swan: The Impact of the Highly Improbable (Incerto),Nassim Nicholas Taleb,2007-04-17,4.3,2723
630,Computers & Technology,First Little Readers Parent Pack: Guided Reading Level C: 25 Irresistible Books That Are Just the Right Level for Beginning Readers,Liza Charlesworth,2010-10-01,4.8,2500
631,Computers & Technology,Macbeth (Arkangel Shakespeare),William Shakespeare,2005-04-22,4.5,2425
632,Computers & Technology,HTML and CSS: Design and Build Websites,Jon Duckett,2011-11-08,4.7,2383
633,Computers & Technology,Building a StoryBrand: Clarify Your Message So Customers Will Listen,Donald Miller,2017-10-10,4.7,2353
634,Computers & Technology,"The Animator's Survival Kit, Expanded Edition: A Manual of Methods, Principles and Formulas for Classical, Computer, Games, Stop Motion and Internet Animators",Richard E. Williams,2009-12-08,4.8,2348
635,Computers & Technology,"Web Design with HTML, CSS, JavaScript and jQuery Set",Jon Duckett,2014-07-08,4.7,2298
636,Computers & Technology,Thing Explainer: Complicated Stuff in Simple Words,Randall Munroe,2015-11-24,4.4,2255
637,Computers & Technology,CompTIA Security+ Get Certified Get Ahead: SY0-501 Study Guide,Darril Gibson,2017-10-12,4.7,2234
638,Computers & Technology,"Crushing It!: How Great Entrepreneurs Build Their Business and Influence-and How You Can, Too",Gary Vaynerchuk,2018-01-30,4.7,2154
639,"Cookbooks, Food & Wine","The Easy 5-Ingredient Ketogenic Diet Cookbook: Low-Carb, High-Fat Recipes for Busy People on the Keto Diet",Jen Fisch,2018-01-09,4.4,5658
640,"Cookbooks, Food & Wine",The Step-by-Step Instant Pot Cookbook: 100 Simple Recipes for Spectacular Results -- with Photographs of Every Step,Jeffrey Eisner,2020-04-14,4.8,5609
641,"Cookbooks, Food & Wine",Lean in 15: 15-Minute Meals and Workouts to Keep You Lean and Healthy,Joe Wicks,2016-05-03,4.6,5529
642,"Cookbooks, Food & Wine","Simply Keto: A Practical Approach to Health & Weight Loss, with 100+ Easy Low-Carb Recipes (1)",Suzanne Ryan,2017-12-12,4.7,5499
643,"Cookbooks, Food & Wine","The Keto Diet: The Complete Guide to a High-Fat Diet, with More Than 125 Delectable Recipes and 5 Meal Plans to Shed Weight, Heal Your Body, and Regain Confidence",Leanne Vogel,2017-04-11,4.4,5262
644,"Cookbooks, Food & Wine","From Crook to Cook: Platinum Recipes from Tha Boss Dogg's Kitchen (Snoop Dogg Cookbook, Celebrity Cookbook with Soul Food Recipes)",Snoop Dogg,2018-10-23,4.8,5198
645,"Cookbooks, Food & Wine",Flour Water Salt Yeast: The Fundamentals of Artisan Bread and Pizza [A Cookbook],Ken Forkish,2012-09-18,4.7,5186
646,"Cookbooks, Food & Wine",Cravings: Recipes for All the Food You Want to Eat: A Cookbook,Chrissy Teigen,2016-02-23,4.7,5132
647,"Cookbooks, Food & Wine",Ball Complete Book of Home Preserving,Judi Kingry,2020-05-01,4.8,5092
648,"Cookbooks, Food & Wine",Franklin Barbecue: A Meat-Smoking Manifesto [A Cookbook],Aaron Franklin,2015-04-07,4.7,4990
649,"Cookbooks, Food & Wine",What the F*@# Should I Make for Dinner?: The Answers to Life s Everyday Question (in 50 F*@#ing Recipes) (A What The F* Book),Zach Golden,2011-09-27,4.5,4916
650,"Cookbooks, Food & Wine",Veg: Easy & Delicious Meals for Everyone,Jame Oliver,2019-08-22,4.5,4861
651,"Cookbooks, Food & Wine",BOSH!: Simple Recipes * Amazing Food * All Plants (BOSH Series),Ian Theasby,2018-05-01,4.6,4804
652,"Cookbooks, Food & Wine",The Blue Zones Kitchen: 100 Recipes to Live to 100,Dan Buettner,2019-12-03,4.5,4710
653,"Cookbooks, Food & Wine","The Complete Mediterranean Cookbook: 500 Vibrant, Kitchen-Tested Recipes for Living and Eating Well Every Day",America's Test Kitchen,2016-12-27,4.6,4691
654,"Cookbooks, Food & Wine","4-Hour Body An Uncommon Guide to Rapid Fat-Loss, Incredible Sex and Becoming Superhuman",Timothy Ferriss,2011-01-27,4.3,4680
655,"Crafts, Hobbies & Home","Adult Coloring Book : Stress Relieving Designs Animals, Mandalas, Flowers, Paisley Patterns And So Much More: Coloring Book For Adults",Cindy Elsharouni,2017-11-17,4.6,9382
656,"Crafts, Hobbies & Home",A Street Cat Named Bob: And How He Saved My Life,James Bowen,2014-10-07,4.8,8956
657,"Crafts, Hobbies & Home",The Lost Symbol (Robert Langdon),Dan Brown,2010-10-19,4.7,8930
658,"Crafts, Hobbies & Home",Alice's Adventures in Wonderland (Dover Thrift Editions),Lewis Carroll,1993-05-20,4.5,8239
659,"Crafts, Hobbies & Home",Lettering and Modern Calligraphy: A Beginner's Guide: Learn Hand Lettering and Brush Lettering,Paper Peony Press,2017-10-27,4.4,8141
660,"Crafts, Hobbies & Home",The Magnolia Story,Chip Gaines,2016-10-18,4.8,8035
661,"Crafts, Hobbies & Home",Disney Dreams Collection Thomas Kinkade Studios Coloring Book,Thomas Kinkade,2017-09-19,4.7,7989
662,"Crafts, Hobbies & Home",Instant Pot Pressure Cooker Cookbook: 500 Everyday Recipes for Beginners and Advanced Users. Try Easy and Healthy Instant Pot Recipes.,Jennifer Smith,2018-09-20,4.4,7781
663,"Crafts, Hobbies & Home",Hinch Yourself Happy: All The Best Cleaning Tips To Shine Your Sink And Soothe Your Soul,Mrs Hinch,2019-04-04,4.7,7723
664,"Crafts, Hobbies & Home","Wheat Belly: Lose the Wheat, Lose the Weight, and Find Your Path Back to Health",William Davis,2014-06-03,4.4,7572
665,"Crafts, Hobbies & Home",Medical Medium: Secrets Behind Chronic and Mystery Illness and How to Finally Heal,Anthony William,2015-11-10,4.6,7520
666,"Crafts, Hobbies & Home",The Old Man And The Sea (Scribner Classics),Ernest Hemingway,1996-06-10,4.6,7303
667,"Crafts, Hobbies & Home",Mrs Hinch: The Activity Journal,Mrs Hinch,2019-10-17,4.8,6930
668,"Crafts, Hobbies & Home",Forks Over Knives―The Cookbook: Over 300 Recipes for Plant-Based Eating All Through the Year,Del Sroufe,2012-08-14,4.5,6908
669,"Crafts, Hobbies & Home",Dracula (Chiltern Classic),Bram Stoker,2020-09-08,4.5,6816
670,"Crafts, Hobbies & Home",Unicorn Coloring Book: For Kids Ages 4-8 (US Edition) (Silly Bear Coloring Books),Silly Bear,2018-06-06,4.8,6610
671,Education & Teaching,Mindset: The New Psychology of Success,Carol S. Dweck,2007-12-26,4.6,5850
672,Education & Teaching,The Beginner's Bible: Timeless Children's Stories,Zondervan,2016-10-04,4.8,5831
